<?xml version="1.0" encoding="Windows-1251"?>
<!DOCTYPE psalm SYSTEM "psalm.dtd">
<?xml-stylesheet type="text/xsl" href="Page.xsl"?>
<psalm nr="20">
	<title>
		<num>№</num> Pал0мъ дв7ду, <num>к7</num>.</title>
	<verse nr="1">
		<slav>
			<initial>Г</initial>Dи, си1лою твоeю возвесели1тсz цaрь, и3 њ спcніи твоeмъ возрaдуетсz ѕэлw2.</slav>
		<rus>Господи! силою Твоею веселится царь и о спасении Твоем безмерно радуется.</rus>
	</verse>
	<verse nr="2">
		<slav>
			<num>G</num> Желaніе сeрдца є3гw2 дaлъ є3си2 є3мY, и3 хотёніz ўстнY є3гw2 нёси лиши1лъ є3го2.</slav>
		<rus>Ты дал ему, чего желало сердце его, и прошения уст его не отринул,</rus>
	</verse>
	<verse nr="3">
		<slav>
			<num>д7</num> Ћкw предвари1лъ є3си2 є3го2 блгcвeніемъ бlгостhннымъ, положи1лъ є3си2 на главЁ є3гw2 вэнeцъ t кaмене чeстна.</slav>
		<rus>ибо Ты встретил его благословениями благости, возложил на голову его венец из чистого золота.</rus>
	</verse>
	<verse nr="4">
		<slav>
			<num>є7</num> ЖивотA проси1лъ є4сть ў тебє2, и3 дaлъ є3си2 є3мY долготY днjй во вёкъ вёка.</slav>
		<rus>Он просил у Тебя жизни; Ты дал ему долгоденствие на век и век.</rus>
	</verse>
	<verse nr="5">
		<slav>
			<num>ѕ7</num> Вeліz слaва є3гw2 спcніемъ твои1мъ: слaву и3 велелёпіе возложи1ши на него2.</slav>
		<rus>Велика слава его в спасении Твоем; Ты возложил на него честь и величие.</rus>
	</verse>
	<verse nr="6">
		<slav>
			<num>з7</num> Ћкw дaси є3мY блгcвeніе во вёкъ вёка: возвесели1ши є3гw2 рaдостію съ лицeмъ твои1мъ.</slav>
		<rus>Ты положил на него благословения на веки, возвеселил его радостью лица Твоего,</rus>
	</verse>
	<verse nr="7">
		<slav>
			<num>}</num> Ћкw цaрь ўповaетъ на гDа, и3 млcтію вhшнzгw не подви1житсz.</slav>
		<rus>ибо царь уповает на Господа, и во благости Всевышнего не поколеблется.</rus>
	</verse>
	<verse nr="8">
		<slav>
			<num>f7</num> Да њбрsщетсz рукA твоS всBмъ врагHмъ твои6мъ, десни1ца твоS да њбрsщетъ вс‰ ненави1дzщыz тебE.</slav>
		<rus>Рука Твоя найдет всех врагов Твоих, десница Твоя найдет [всех] ненавидящих Тебя.</rus>
	</verse>
	<verse nr="9">
		<slav>
			<num>‹</num> Ћкw положи1ши и5хъ ћкw пeщь џгненную во врeмz лицA твоегw2: гDь гнёвомъ свои1мъ смzтeтъ |, и3 снёсть и5хъ џгнь.</slav>
		<rus>Во время гнева Твоего Ты сделаешь их, как печь огненную; во гневе Своем Господь погубит их, и пожрет их огонь.</rus>
	</verse>
	<verse nr="10">
		<slav>
			<num>№i</num> Пл0дъ и4хъ t земли2 погуби1ши, и3 сёмz и4хъ t сынHвъ человёческихъ.</slav>
		<rus>Ты истребишь плод их с земли и семя их - из среды сынов человеческих,</rus>
	</verse>
	<verse nr="11">
		<slav>
			<num>в7i</num> Ћкw ўклони1ша на тS ѕл†z, помhслиша совёты, и5хже не возм0гутъ состaвити.</slav>
		<rus>ибо они предприняли против Тебя злое, составили замыслы, но не могли [выполнить их].</rus>
	</verse>
	<verse nr="12">
		<slav>
			<num>Gi</num> Ћкw положи1ши | хребeтъ: во и3збhтцэхъ твои1хъ ўгот0виши лицE и4хъ.</slav>
		<rus>Ты поставишь их целью, из луков Твоих пустишь стрелы в лице их.</rus>
	</verse>
	<verse nr="13">
		<slav>
			<num>д7i</num> Вознеси1сz, гDи, си1лою твоeю: воспоeмъ и3 поeмъ си6лы тво‰.</slav>
		<rus>>Вознесись, Господи, силою Твоею: мы будем воспевать и прославлять Твое могущество.</rus>
	</verse>
</psalm>
