<?xml version="1.0" encoding="Windows-1251"?>
<!DOCTYPE psalm SYSTEM "psalm.dtd">
<?xml-stylesheet type="text/xsl" href="Page.xsl"?>
<psalm nr="56">
	<title>
		<num>№</num> Въ конeцъ, да не растли1ши, дв7ду въ столпописaніе, внегдA є3мY tбэгaти t лицA саyлова въ пещeру, <num>н7ѕ</num>.</title>
	<verse nr="1">
		<slav>
			<initial>П</initial>оми1луй мS, б9е, поми1луй мS: ћкw на тS ўповA душA моS, и3 на сёнь крилу3 твоє1ю надёюсz, д0ндеже прeйдетъ беззак0ніе.</slav>
		<rus>Помилуй меня, Боже, помилуй меня, ибо на Тебя уповает душа моя, и в тени крыл Твоих я укроюсь, доколе не пройдут беды.</rus>
	</verse>
	<verse nr="2">
		<slav>
			<num>G</num> ВоззовY къ бGу вhшнему, бGу бlгодёzвшему мнЁ.</slav>
		<rus>Воззову к Богу Всевышнему, Богу, благодетельствующему мне;</rus>
	</verse>
	<verse nr="3">
		<slav>
			<num>д7</num> ПослA съ нб7сE и3 сп7сe мz, дадE въ поношeніе попирaющыz мS: послA бGъ млcть свою2 и3 и4стину свою2,</slav>
		<rus>Он пошлет с небес и спасет меня; посрамит ищущего поглотить меня; пошлет Бог милость Свою и истину Свою.</rus>
	</verse>
	<verse nr="4">
		<slav>
			<num>є7</num> и3 и3збaви дyшу мою2 t среды2 скЂмнwвъ. Поспaхъ смущeнъ: сhнове человёчестіи, зyбы и4хъ nр{жіz и3 стрёлы, и3 z3зhкъ и4хъ мeчь џстръ. </slav>
		<rus>Душа моя среди львов; я лежу среди дышущих пламенем, среди сынов человеческих, у которых зубы - копья и стрелы, и у которых язык - острый меч.</rus>
	</verse>
	<verse nr="5">
		<slav>
			<num>ѕ7</num> Вознеси1сz на нб7сA, б9е, и3 по всeй земли2 слaва твоS.</slav>
		<rus>Будь превознесен выше небес, Боже, и над всею землею да будет слава Твоя!</rus>
	</verse>
	<verse nr="6">
		<slav>
			<num>з7</num> Сёть ўгот0ваша ногaмъ мои6мъ, и3 слzк0ша дyшу мою2: и3скопaша пред8 лицeмъ мои1мъ ћму, и3 впад0ша въ ню2.</slav>
		<rus>Приготовили сеть ногам моим; душа моя поникла; выкопали предо мною яму, и сами упали в нее.</rus>
	</verse>
	<verse nr="7">
		<slav>
			<num>}</num> Гот0во сeрдце моE, б9е, гот0во сeрдце моE: воспою2  и пою2 во слaвэ моeй.</slav>
		<rus>Готово сердце мое, Боже, готово сердце мое: буду петь и славить.</rus>
	</verse>
	<verse nr="8">
		<slav>
			<num>f7</num> Востaни, слaва моS, востaни, pалти1рю и3 гyсли: востaну рaнw.</slav>
		<rus>Воспрянь, слава моя, воспрянь, псалтирь и гусли! Я встану рано.</rus>
	</verse>
	<verse nr="9">
		<slav>
			<num>‹</num> И#сповёмсz тебЁ въ лю1дехъ, гDи, воспою2 тебЁ во kзhцэхъ:</slav>
		<rus>Буду славить Тебя, Господи, между народами; буду воспевать Тебя среди племен,</rus>
	</verse>
	<verse nr="10">
		<slav>
			<num>№i</num> ћкw возвели1чисz до нб7съ млcть твоS и3 дaже до w4блакъ и4стина твоS.</slav>
		<rus>ибо до небес велика милость Твоя и до облаков истина Твоя.</rus>
	</verse>
	<verse nr="11">
		<slav>
			<num>в7i</num> Вознеси1сz на нб7сA, б9е, и3 по всeй земли2 слaва твоS.</slav>
		<rus>Будь превознесен выше небес, Боже, и над всею землею да будет слава Твоя!</rus>
	</verse>
</psalm>
