<?xml version="1.0" encoding="Windows-1251"?>
<!DOCTYPE psalm SYSTEM "psalm.dtd">
<?xml-stylesheet type="text/xsl" href="Page.xsl"?>
<psalm nr="52">
	<title>
		<num>№</num> Въ конeцъ, њ маелefэ, рaзума дв7ду, <num>н7в</num>.</title>
	<verse nr="1">
		<slav>
			<initial>Р</initial>ечE безyменъ въ сeрдцы своeмъ: нёсть бGъ. Растлёша и3 њмерзи1шасz въ беззак0ніихъ, нёсть творsй бlг0е.</slav>
		<rus>Сказал безумец в сердце своем: "нет Бога". Развратились они и совершили гнусные преступления; нет делающего добро.</rus>
	</verse>
	<verse nr="2">
		<slav>
			<num>G</num> БGъ съ нб7сE прини1че на сhны человёчєскіz, ви1дэти, ѓще є4сть разумэвazй и3ли2 взыскazй бGа.</slav>
		<rus>Бог с небес призрел на сынов человеческих, чтобы видеть, есть ли разумеющий, ищущий Бога.</rus>
	</verse>
	<verse nr="3">
		<slav>
			<num>д7</num> Вси2 ўклони1шасz, вкyпэ непотрeбни бhша: нёсть творsй бlг0е, нёсть до є3ди1нагw.</slav>
		<rus>Все уклонились, сделались равно непотребными; нет делающего добро, нет ни одного.</rus>
	</verse>
	<verse nr="4">
		<slav>
			<num>є7</num> Ни ли2 ўразумёютъ вси2 дёлающіи беззак0ніе, снэдaющіи лю1ди мо‰ въ снёдь хлёба; гDа не призвaша.</slav>
		<rus>Неужели не вразумятся делающие беззаконие, съедающие народ мой, как едят хлеб, и не призывающие Бога?</rus>
	</verse>
	<verse nr="5">
		<slav>
			<num>ѕ7</num> Тaмw ўстраши1шасz стрaха, и3дёже не бЁ стрaхъ: ћкw бGъ разсhпа кHсти человэкоуг0дникwвъ: постыдёшасz, ћкw бGъ ўничижи2 и5хъ.</slav>
		<rus>Там убоятся они страха, где нет страха, ибо рассыплет Бог кости ополчающихся против тебя. Ты постыдишь их, потому что Бог отверг их.</rus>
	</verse>
	<verse nr="6">
		<slav>
			<num>з7</num> Кто2 дaстъ t сіHна сп7сeніе ї}лево; внегдA возврати1тъ бGъ плэнeніе людjй свои1хъ, возрaдуетсz їaкwвъ и3 возвесели1тсz ї}ль.</slav>
		<rus>Кто даст с Сиона спасение Израилю! Когда Бог возвратит пленение народа Своего, тогда возрадуется Иаков и возвеселится Израиль.</rus>
	</verse>
</psalm>
