<?xml version="1.0" encoding="Windows-1251"?>
<!DOCTYPE psalm SYSTEM "psalm.dtd">
<?xml-stylesheet type="text/xsl" href="Page.xsl"?>
<psalm nr="67">
	<title>
		<num>№</num> Въ конeцъ, pал0мъ пёсни дв7ду, <num>…з</num>.</title>
	<verse nr="1">
		<slav>
			<initial>Д</initial>а воскрcнетъ бGъ, и3 расточaтсz врази2 є3гw2, и3 да бэжaтъ t лицA є3гw2 ненави1дzщіи є3го2.</slav>
		<rus>Да восстанет Бог, и расточатся враги Его, и да бегут от лица Его ненавидящие Его.</rus>
	</verse>
	<verse nr="2">
		<slav>
			<num>G</num> Ћкw и3зчезaетъ дhмъ, да и3зчeзнутъ: ћкw тaетъ в0скъ t лицA nгнS, тaкw да поги1бнутъ грBшницы t лицA б9іz:</slav>
		<rus>Как рассеивается дым, Ты рассей их; как тает воск от огня, так нечестивые да погибнут от лица Божия.</rus>
	</verse>
	<verse nr="3">
		<slav>
			<num>д7</num> ґ првdницы да возвеселsтсz, да возрaдуютсz пред8 бGомъ, да насладsтсz въ весeліи.</slav>
		<rus>А праведники да возвеселятся, да возрадуются пред Богом и восторжествуют в радости.</rus>
	</verse>
	<verse nr="4">
		<slav>
			<num>є7</num> Восп0йте бGу, п0йте и4мени є3гw2: путесотвори1те возшeдшему на зaпады, гDь и4мz є3мY: и3 рaдуйтесz пред8 ни1мъ.</slav>
		<rus>Пойте Богу нашему, пойте имени Его, превозносите Шествующего на небесах; имя Ему: Господь, и радуйтесь пред лицем Его.</rus>
	</verse>
	<verse nr="5">
		<slav>
			<num>ѕ7</num> Да смzтyтсz t лицA є3гw2, nц7A си1рыхъ и3 судіи2 вдови1цъ: бGъ въ мёстэ с™ёмъ своeмъ.</slav>
		<rus>Отец сирот и судья вдов Бог во святом Своем жилище.</rus>
	</verse>
	<verse nr="6">
		<slav>
			<num>з7</num> БGъ вселsетъ є3диномhслєнныz въ д0мъ, и3зводS њков†нныz мyжествомъ, тaкожде преwгорчевaющыz живyщыz во гробёхъ.</slav>
		<rus>Бог одиноких вводит в дом, освобождает узников от оков, а непокорные остаются в знойной пустыне.</rus>
	</verse>
	<verse nr="7">
		<slav>
			<num>}</num> Б9е, внегдA и3сходи1ти тебЁ пред8 людьми2 твои1ми, внегдA мимоходи1ти тебЁ въ пустhни,</slav>
		<rus>Боже! когда Ты выходил пред народом Твоим, когда Ты шествовал пустынею,</rus>
	</verse>
	<verse nr="8">
		<slav>
			<num>f7</num> землS потрzсeсz, и4бо небесA кaнуша t лицA бGа сінaина, t лицA бGа ї}лева.</slav>
		<rus>земля тряслась, даже небеса таяли от лица Божия, и этот Синай - от лица Бога, Бога Израилева.</rus>
	</verse>
	<verse nr="9">
		<slav>
			<num>‹</num> Д0ждь в0ленъ tлучи1ши, б9е, достоsнію твоемY, и3 и3знем0же, тh же соверши1лъ є3си2 є5.</slav>
		<rus>Обильный дождь проливал Ты, Боже, на наследие Твое, и когда оно изнемогало от труда, Ты подкреплял его.</rus>
	</verse>
	<verse nr="10">
		<slav>
			<num>№i</num> ЖивHтнаz тво‰ живyтъ на нeй: ўгот0валъ є3си2 бlгостію твоeю ни1щему, б9е.</slav>
		<rus>Народ Твой обитал там; по благости Твоей, Боже, Ты готовил необходимое для бедного.</rus>
	</verse>
	<verse nr="11">
		<slav>
			<num>в7i</num> ГDь дaстъ глаг0лъ благовэствyющымъ си1лою мн0гою:</slav>
		<rus>Господь даст слово: провозвестниц великое множество.</rus>
	</verse>
	<verse nr="12">
		<slav>
			<num>Gi</num> цRь си1лъ возлю1бленнагw, красот0ю (рaди красоты2) д0му раздэли1ти кwрhсти.</slav>
		<rus>Цари воинств бегут, бегут, а сидящая дома делит добычу.</rus>
	</verse>
	<verse nr="13">
		<slav>
			<num>д7i</num> Ѓще поспитE посредЁ предBлъ, крилB голуби6нэ посрeбрєнэ, и3 междор†міz є3S въ блещaніи злaта:</slav>
		<rus>Расположившись в уделах [своих], вы стали, как голубица, которой крылья покрыты серебром, а перья чистым золотом:</rus>
	</verse>
	<verse nr="14">
		<slav>
			<num>є7i</num> внегдA рaзнствитъ нбcный цари6 на нeй, њснэжaтсz въ селмHнэ.</slav>
		<rus>когда Всемогущий рассеял царей на сей земле, она забелела, как снег на Селмоне.</rus>
	</verse>
	<verse nr="15">
		<slav>
			<num>ѕ7i</num> ГорA б9іz, горA тyчнаz, горA ўсырeннаz, горA тyчнаz.</slav>
		<rus>Гора Божия - гора Васанская! гора высокая - гора Васанская!</rus>
	</verse>
	<verse nr="16">
		<slav>
			<num>з7i</num> Вскyю непщyете, г0ры ўсырє1нныz; горA, ю4же бlговоли2 бGъ жи1ти въ нeй: и4бо гDь всели1тсz до концA.</slav>
		<rus>что вы завистливо смотрите, горы высокие, на гору, на которой Бог благоволит обитать и будет Господь обитать вечно?</rus>
	</verse>
	<verse nr="17">
		<slav>
			<num>}i</num> Колесни1ца б9іz тмaми тeмъ, тhсzща гобзyющихъ: гDь въ ни1хъ въ сінaи во с™ёмъ.</slav>
		<rus>Колесниц Божиих тьмы, тысячи тысяч; среди их Господь на Синае, во святилище.</rus>
	</verse>
	<verse nr="18">
		<slav>
			<num>f7i</num> Возшeлъ є3си2 на высотY, плэни1лъ є3си2 плёнъ: пріsлъ є3си2 да‰ніz въ человёцэхъ, и4бо не покарsющыzсz, є4же всели1тисz.</slav>
		<rus>Ты восшел на высоту, пленил плен, принял дары для человеков, так чтоб и из противящихся могли обитать у Господа Бога.</rus>
	</verse>
	<verse nr="19">
		<slav>
			<num>к7</num> ГDь бGъ бlгcвeнъ, бlгcвeнъ гDь дeнь днE: поспэши1тъ нaмъ бGъ спcній нaшихъ.</slav>
		<rus>Благословен Господь всякий день. Бог возлагает на нас бремя, но Он же и спасает нас.</rus>
	</verse>
	<verse nr="20">
		<slav>
			<num>к7а</num> БGъ нaшъ бGъ є4же сп7сaти: и3 гDнz, гDнz и3схHдища смє1ртнаz.</slav>
		<rus>Бог для нас - Бог во спасение; во власти Господа Вседержителя врата смерти.</rus>
	</verse>
	<verse nr="21">
		<slav>
			<num>к7в</num> Nбaче бGъ сокруши1тъ главы6 врагHвъ свои1хъ, вeрхъ вл†съ преходsщихъ въ прегрэшeніихъ свои1хъ.</slav>
		<rus>Но Бог сокрушит голову врагов Своих, волосатое темя закоснелого в своих беззакониях.</rus>
	</verse>
	<verse nr="22">
		<slav>
			<num>к7г</num> РечE гDь: t васaна њбращY, њбращY во глубинaхъ морски1хъ:</slav>
		<rus>Господь сказал: [от Васана возвращу, выведу из глубины морской,</rus>
	</verse>
	<verse nr="23">
		<slav>
			<num>к7д</num> ћкw да њм0читсz ногA твоS въ кр0ви, z3зhкъ пє1съ твои1хъ t вр†гъ t негw2.</slav>
		<rus>чтобы ты погрузил ногу твою, как и псы твои язык свой, в крови врагов].</rus>
	</verse>
	<verse nr="24">
		<slav>
			<num>к7є</num> Ви6дэна бhша шє1ствіz тво‰, б9е, шє1ствіz бGа моегw2 цRS, и4же во с™ёмъ.</slav>
		<rus>Видели шествие Твое, Боже, шествие Бога моего, Царя моего во святыне:</rus>
	</verse>
	<verse nr="25">
		<slav>
			<num>к7ѕ</num> Предвари1ша кн‰зи бли1з8 пою1щихъ, посредЁ дёвъ тmмпaнницъ.</slav>
		<rus>впереди шли поющие, позади играющие на орудиях, в средине девы с тимпанами:</rus>
	</verse>
	<verse nr="26">
		<slav>
			<num>к7з</num> Въ цRквахъ благослови1те бGа, гDа t и3стHчникъ ї}левыхъ.</slav>
		<rus>"в собраниях благословите Бога Господа, вы - от семени Израилева!"</rus>
	</verse>
	<verse nr="27">
		<slav>
			<num>к7и</num> Тaмw веніамjнъ ю3нёйшій во ќжасэ, кн‰зи їyдовы владhки и4хъ, кн‰зи завулw6ни, кнsзи нефfал‡мли. </slav>
		<rus>Там Вениамин младший - князь их; князья Иудины - владыки их, князья Завулоновы, князья Неффалимовы.</rus>
	</verse>
	<verse nr="28">
		<slav>
			<num>к7f</num> Заповёждь, б9е, си1лою твоeю: ўкрэпи2, б9е, сіE, є4же содёлалъ є3си2 въ нaсъ.</slav>
		<rus>Бог твой предназначил тебе силу. Утверди, Боже, то, что Ты соделал для нас!</rus>
	</verse>
	<verse nr="29">
		<slav>
			<num>l</num> T хрaма твоегw2 во їерcли1мъ тебЁ принесyтъ цaріе дaры.</slav>
		<rus>Ради храма Твоего в Иерусалиме цари принесут Тебе дары.</rus>
	</verse>
	<verse nr="30">
		<slav>
			<num>lа</num> Запрети2 ѕвэрє1мъ трHстнымъ: с0нмъ ю3нє1цъ въ ю4ницахъ людски1хъ, є4же затвори1ти и3скушє1нныz сребр0мъ: расточи2 kзhки хотsщыz брaнемъ.</slav>
		<rus>Укроти зверя в тростнике, стадо волов среди тельцов народов, хвалящихся слитками серебра; рассыпь народы, желающие браней.</rus>
	</verse>
	<verse nr="31">
		<slav>
			<num>lв</num> Пріи1дутъ моли6твенницы t є3гЂпта: є3fі0піа предвари1тъ рyку свою2 къ бGу.</slav>
		<rus>Придут вельможи из Египта; Ефиопия прострет руки свои к Богу.</rus>
	</verse>
	<verse nr="32">
		<slav>
			<num>lг</num> Ц†рства земн†z, п0йте бGу, восп0йте гDеви,</slav>
		<rus>Царства земные! пойте Богу, воспевайте Господа,</rus>
	</verse>
	<verse nr="33">
		<slav>
			<num>lд</num> возшeдшему на нб7о нб7сE на вост0ки: сE, дaстъ глaсу своемY глaсъ си1лы.</slav>
		<rus>шествующего на небесах небес от века. Вот, Он дает гласу Своему глас силы.</rus>
	</verse>
	<verse nr="34">
		<slav>
			<num>lє</num> Дади1те слaву бGови: на ї}ли велелёпота є3гw2, и3 си1ла є3гw2 на w4блацэхъ.</slav>
		<rus>Воздайте славу Богу! величие Его - над Израилем, и могущество Его - на облаках.</rus>
	</verse>
	<verse nr="35">
		<slav>
			<num>lѕ</num> Ди1венъ бGъ во с™hхъ свои1хъ: бGъ ї}левъ, т0й дaстъ си1лу и3 держaву лю1демъ свои6мъ. Бlгcвeнъ бGъ.</slav>
		<rus>Страшен Ты, Боже, во святилище Твоем. Бог Израилев - Он дает силу и крепость народу [Своему]. Благословен Бог!</rus>
	</verse>
</psalm>
