<?xml version="1.0" encoding="Windows-1251"?>
<!DOCTYPE psalm SYSTEM "psalm.dtd">
<?xml-stylesheet type="text/xsl" href="Page.xsl"?>
<psalm nr="131">
	<title>Пёснь степeней, <num>рlа</num>.</title>
	<verse nr="1">
		<slav>
			<initial>П</initial>омzни2, гDи, дв7да и3 всю2 кр0тость є3гw2:</slav>
		<rus>Вспомни, Господи, Давида и все сокрушение его:</rus>
	</verse>
	<verse nr="2">
		<slav>
			<num>в7</num> ћкw клsтсz гDеви, њбэщaсz бGу їaкwвлю:</slav>
		<rus>как он клялся Господу, давал обет Сильному Иакова:</rus>
	</verse>
	<verse nr="3">
		<slav>
			<num>G</num> ѓще вни1ду въ селeніе д0му моегw2, и3ли2 взhду на џдръ постeли моеS:</slav>
		<rus>"не войду в шатер дома моего, не взойду на ложе мое;</rus>
	</verse>
	<verse nr="4">
		<slav>
			<num>д7</num> ѓще дaмъ с0нъ nчи1ма мои1ма, и3 вёждома мои1ма дремaніе, и3 пок0й скраніaма мои1ма:</slav>
		<rus>не дам сна очам моим и веждам моим - дремания,</rus>
	</verse>
	<verse nr="5">
		<slav>
			<num>є7</num> д0ндеже њбрsщу мёсто гDеви, селeніе бGу їaкwвлю.</slav>
		<rus>доколе не найду места Господу, жилища - Сильному Иакова".</rus>
	</verse>
	<verse nr="6">
		<slav>
			<num>ѕ7</num> СE, слhшахомъ | во є3vфрafэ, њбрэт0хомъ | въ полsхъ дубрaвы:</slav>
		<rus>Вот, мы слышали о нем в Ефрафе, нашли его на полях Иарима.</rus>
	</verse>
	<verse nr="7">
		<slav>
			<num>з7</num> вни1демъ въ селє1ніz є3гw2, поклони1мсz на мёсто, и3дёже стоsстэ н0зэ є3гw2.</slav>
		<rus>Пойдем к жилищу Его, поклонимся подножию ног Его.</rus>
	</verse>
	<verse nr="8">
		<slav>
			<num>}</num> Воскcрни, гDи, въ пок0й тв0й, ты2 и3 ківHтъ с™hни твоеS.</slav>
		<rus>Стань, Господи, на место покоя Твоего, - Ты и ковчег могущества Твоего.</rus>
	</verse>
	<verse nr="9">
		<slav>
			<num>f7</num> Сщ7eнницы твои2 њблекyтсz прaвдою, и3 прпdбніи твои2 возрaдуютсz.</slav>
		<rus>Священники Твои облекутся правдою, и святые Твои возрадуются.</rus>
	</verse>
	<verse nr="10">
		<slav>
			<num>‹</num> Дв7да рaди рабA твоегw2, не tврати2 лицE помaзаннагw твоегw2.</slav>
		<rus>Ради Давида, раба Твоего, не отврати лица помазанника Твоего.</rus>
	</verse>
	<verse nr="11">
		<slav>
			<num>№i</num> Клsтсz гDь дв7ду и4стиною, и3 не tвeржетсz є3S: t плодA чрeва твоегw2 посаждY на прест0лэ твоeмъ.</slav>
		<rus>Клялся Господь Давиду в истине, и не отречется ее: "от плода чрева твоего посажу на престоле твоем.</rus>
	</verse>
	<verse nr="12">
		<slav>
			<num>в7i</num> Ѓще сохранsтъ сhнове твои2 завётъ м0й и3 свидBніz мо‰ сі‰, и5мже научY |, и3 сhнове и4хъ до вёка сsдутъ на прест0лэ твоeмъ.</slav>
		<rus>Если сыновья твои будут сохранять завет Мой и откровения Мои, которым Я научу их, то и их сыновья во веки будут сидеть на престоле твоем".</rus>
	</verse>
	<verse nr="13">
		<slav>
			<num>Gi</num> Ћкw и3збрA гDь сіHна, и3зв0ли и5 въ жили1ще себЁ.</slav>
		<rus>Ибо избрал Господь Сион, возжелал [его] в жилище Себе.</rus>
	</verse>
	<verse nr="14">
		<slav>
			<num>д7i</num> Сeй пок0й м0й во вёкъ вёка, здЁ вселю1сz, ћкw и3зв0лихъ и5. </slav>
		<rus>"Это покой Мой на веки: здесь вселюсь, ибо Я возжелал его.</rus>
	</verse>
	<verse nr="15">
		<slav>
			<num>є7i</num> Лови1тву є3гw2 блгcвлszй блгcвлю2, ни1щыz є3гw2 насhщу хлBбы:</slav>
		<rus>Пищу его благословляя благословлю, нищих его насыщу хлебом;</rus>
	</verse>
	<verse nr="16">
		<slav>
			<num>ѕ7i</num> сщ7eнники є3гw2 њблекY во спcніе, и3 прпdбніи є3гw2 рaдостію возрaдуютсz.</slav>
		<rus>священников его облеку во спасение, и святые его радостью возрадуются.</rus>
	</verse>
	<verse nr="17">
		<slav>
			<num>з7i</num> Тaмw возращY р0гъ дв7дови, ўгот0вахъ свэти1лникъ помaзанному моемY.</slav>
		<rus>Там возращу рог Давиду, поставлю светильник помазаннику Моему.</rus>
	</verse>
	<verse nr="18">
		<slav>
			<num>}i</num> Враги2 є3гw2 њблекY студ0мъ, на нeм же процвэтeтъ с™hнz моS.</slav>
		<rus>Врагов его облеку стыдом, а на нем будет сиять венец его".</rus>
	</verse>
</psalm>
