<?xml version="1.0" encoding="Windows-1251"?>
<!DOCTYPE psalm SYSTEM "psalm.dtd">
<?xml-stylesheet type="text/xsl" href="Page.xsl"?>
<psalm nr="102">
	<title>Pал0мъ дв7ду, <num>Rв</num>.</title>
	<verse nr="1">
		<slav>
			<initial>Б</initial>лагослови2, душE моS, гDа, и3 вс‰ внyтрєннzz мо‰, и4мz с™ое є3гw2: </slav>
		<rus>Благослови, душа моя, Господа, и вся внутренность моя - святое имя Его.</rus>
	</verse>
	<verse nr="2">
		<slav>
			<num>в7</num> благослови2, душE моS, гDа, и3 не забывaй всёхъ воздаsній є3гw2:</slav>
		<rus>Благослови, душа моя, Господа и не забывай всех благодеяний Его.</rus>
	</verse>
	<verse nr="3">
		<slav>
			<num>G</num> њчищaющаго вс‰ беззакHніz тво‰, и3зцэлsющаго вс‰ недyги тво‰,</slav>
		<rus>Он прощает все беззакония твои, исцеляет все недуги твои;</rus>
	</verse>
	<verse nr="4">
		<slav>
			<num>д7</num> и3збавлsющаго t и3стлёніz жив0тъ тв0й, вэнчaющаго тS млcтію и3 щедр0тами,</slav>
		<rus>избавляет от могилы жизнь твою, венчает тебя милостью и щедротами;</rus>
	</verse>
	<verse nr="5">
		<slav>
			<num>є7</num> и3сполнsющаго во бlги1хъ желaніе твоE: њбнови1тсz ћкw џрлz ю4ность твоS.</slav>
		<rus>насыщает благами желание твое: обновляется, подобно орлу, юность твоя.</rus>
	</verse>
	<verse nr="6">
		<slav>
			<num>ѕ7</num> Творsй млcтыни гDь и3 судбY всBмъ њби6димымъ.</slav>
		<rus>Господь творит правду и суд всем обиженным.</rus>
	</verse>
	<verse nr="7">
		<slav>
			<num>з7</num> СказA пути6 сво‰ мwmсeови, сыновHмъ ї}лєвымъ хотBніz сво‰.</slav>
		<rus>Он показал пути Свои Моисею, сынам Израилевым - дела Свои.</rus>
	</verse>
	<verse nr="8">
		<slav>
			<num>}</num> Щeдръ и3 млcтивъ гDь, долготерпэли1въ и3 многомлcтивъ.</slav>
		<rus>Щедр и милостив Господь, долготерпелив и многомилостив:</rus>
	</verse>
	<verse nr="9">
		<slav>
			<num>f7</num> Не до концA прогнёваетсz, нижE во вёкъ враждyетъ:</slav>
		<rus>не до конца гневается, и не вовек негодует.</rus>
	</verse>
	<verse nr="10">
		<slav>
			<num>‹</num> не по беззак0ніємъ нaшымъ сотвори1лъ є4сть нaмъ, нижE по грэхHмъ нaшымъ воздaлъ є4сть нaмъ.</slav>
		<rus>Не по беззакониям нашим сотворил нам, и не по грехам нашим воздал нам:</rus>
	</verse>
	<verse nr="11">
		<slav>
			<num>№i</num> Ћкw по высотЁ небeснэй t земли2, ўтверди1лъ є4сть гDь млcть свою2 на боsщихсz є3гw2:</slav>
		<rus>ибо как высоко небо над землею, так велика милость [Господа] к боящимся Его;</rus>
	</verse>
	<verse nr="12">
		<slav>
			<num>в7i</num> є3ли1кw tстоsтъ вост0цы t з†падъ, ўдaлилъ є4сть t нaсъ беззакHніz н†ша.</slav>
		<rus>как далеко восток от запада, так удалил Он от нас беззакония наши;</rus>
	</verse>
	<verse nr="13">
		<slav>
			<num>Gi</num> Ћкоже щeдритъ nтецъ сhны, ўщeдри гDь боsщихсz є3гw2.</slav>
		<rus>как отец милует сынов, так милует Господь боящихся Его.</rus>
	</verse>
	<verse nr="14">
		<slav>
			<num>д7i</num> Ћкw т0й познA создaніе нaше, помzнY, ћкw пeрсть є3смы2.</slav>
		<rus>Ибо Он знает состав наш, помнит, что мы - персть.</rus>
	</verse>
	<verse nr="15">
		<slav>
			<num>є7i</num> Человёкъ, ћкw травA днjе є3гw2, ћкw цвётъ сeлный, тaкw њцвэтeтъ:</slav>
		<rus>Дни человека - как трава; как цвет полевой, так он цветет.</rus>
	</verse>
	<verse nr="16">
		<slav>
			<num>ѕ7i</num> ћкw дyхъ пр0йде въ нeмъ, и3 не бyдетъ, и3 не познaетъ ктомY мёста своегw2.</slav>
		<rus>Пройдет над ним ветер, и нет его, и место его уже не узнает его.</rus>
	</verse>
	<verse nr="17">
		<slav>
			<num>з7i</num> Млcть же гDнz t вёка и3 до вёка на боsщихсz є3гw2,</slav>
		<rus>Милость же Господня от века и до века к боящимся Его,</rus>
	</verse>
	<verse nr="18">
		<slav>
			<num>}i</num> и3 прaвда є3гw2 на сынёхъ сынHвъ, хранsщихъ завётъ є3гw2 и3 п0мнzщихъ зaпwвэди є3гw2 твори1ти |.</slav>
		<rus>и правда Его на сынах сынов, хранящих завет Его и помнящих заповеди Его, чтобы исполнять их.</rus>
	</verse>
	<verse nr="19">
		<slav>
			<num>f7i</num> ГDь на нб7си2 ўгот0ва прcт0лъ св0й, и3 цrтво є3гw2 всёми њбладaетъ.</slav>
		<rus>Господь на небесах поставил престол Свой, и царство Его всем обладает.</rus>
	</verse>
	<verse nr="20">
		<slav>
			<num>к7</num> Благослови1те гDа, вси2 ѓггли є3гw2, си1льніи крёпостію, творsщіи сл0во є3гw2, ўслhшати глaсъ словeсъ є3гw2.</slav>
		<rus>Благословите Господа, [все] Ангелы Его, крепкие силою, исполняющие слово Его, повинуясь гласу слова Его;</rus>
	</verse>
	<verse nr="21">
		<slav>
			<num>к7а</num> Благослови1те гDа, вс‰ си6лы є3гw2, слуги6 є3гw2, творsщіи в0лю є3гw2.</slav>
		<rus>благословите Господа, все воинства Его, служители Его, исполняющие волю Его;</rus>
	</verse>
</psalm>
