<?xml version="1.0" encoding="Windows-1251"?>
<!DOCTYPE psalm SYSTEM "psalm.dtd">
<?xml-stylesheet type="text/xsl" href="Page.xsl"?>
<psalm nr="59">
	<title>
		<num>№</num> Въ конeцъ, њ и3змэни1тисz хотsщихъ, въ столпописaніе дв7ду, въ научeніе: </title>
	<verse nr="1">
		<slav>
			<num>в7</num> внегдA сожжE средорёчіе сmрjйское и3 сmрjю совaлскую, и3 возврати1сz їwaвъ и3 порази2 є3дHма въ дeбри солeй дванaдесzть тhсzщъ, <num>н7f</num>.</slav>
		<rus>когда он воевал с Сириею Месопотамскою и с Сириею Цованскою, и когда Иоав, возвращаясь, поразил двенадцать тысяч Идумеев в долине Соляной.</rus>
	</verse>
	<verse nr="2">
		<slav>
			<initial>Б</initial>9е, tри1нулъ ны2 є3си2 и3 низложи1лъ є3си2 нaсъ, разгнёвалсz є3си2 и3 ўщeдрилъ є3си2 нaсъ.</slav>
		<rus>Боже! Ты отринул нас, Ты сокрушил нас, Ты прогневался: обратись к нам.</rus>
	</verse>
	<verse nr="3">
		<slav>
			<num>д7</num> Стрsслъ є3си2 зeмлю и3 смути1лъ є3си2 ю5: и3сцэли2 сокрушeніе є3S, ћкw подви1жесz.</slav>
		<rus>Ты потряс землю, разбил ее: исцели повреждения ее, ибо она колеблется.</rus>
	</verse>
	<verse nr="4">
		<slav>
			<num>є7</num> Показaлъ є3си2 лю1демъ твои6мъ жестHкаz: напои1лъ є3си2 нaсъ він0мъ ўмилeніz.</slav>
		<rus>Ты дал испытать народу твоему жестокое, напоил нас вином изумления.</rus>
	</verse>
	<verse nr="5">
		<slav>
			<num>ѕ7</num> Дaлъ є1си2 боsщымсz тебє2 знaменіе, є4же ўбэжaти t лицA лyка.</slav>
		<rus>Даруй боящимся Тебя знамя, чтобы они подняли его ради истины,</rus>
	</verse>
	<verse nr="6">
		<slav>
			<num>з7</num> Ћкw да и3збaвzтсz возлю1бленніи твои2, сп7си2 десни1цею твоeю и3 ўслhши мS.</slav>
		<rus>чтобы избавились возлюбленные Твои; спаси десницею Твоею и услышь меня.</rus>
	</verse>
	<verse nr="7">
		<slav>
			<num>}</num> БGъ возгlа во с™ёмъ своeмъ: возрaдуюсz, и3 раздэлю2 сіки1му, и3 ю3д0ль жили1щъ размёрю.</slav>
		<rus>Бог сказал во святилище Своем: "восторжествую, разделю Сихем и долину Сокхоф размерю:</rus>
	</verse>
	<verse nr="8">
		<slav>
			<num>f7</num> М0й є4сть галаaдъ, и3 м0й є4сть манассjй, є3фрeмъ крёпость главы2 моеS, їyда цaрь м0й.</slav>
		<rus>Мой Галаад, Мой Манассия, Ефрем крепость главы Моей, Иуда скипетр Мой,</rus>
	</verse>
	<verse nr="9">
		<slav>
			<num>‹</num> Мwaвъ кон0бъ ўповaніz моегw2: на їдумeю прострY сап0гъ м0й: мнЁ и3ноплемє1нницы покори1шасz.</slav>
		<rus>Моав умывальная чаша Моя; на Едома простру сапог Мой. Восклицай Мне, земля Филистимская!"</rus>
	</verse>
	<verse nr="10">
		<slav>
			<num>№i</num> Кто2 введeтъ мS во грaдъ њграждeніz; и3ли2 кто2 настaвитъ мS до їдумeи;</slav>
		<rus>Кто введет меня в укрепленный город? Кто доведет меня до Едома?</rus>
	</verse>
	<verse nr="11">
		<slav>
			<num>в7i</num> Не тh ли, б9е, tри1нувый нaсъ; и3 не и3зhдеши, б9е, въ си1лахъ нaшихъ;</slav>
		<rus>Не Ты ли, Боже, Который отринул нас, и не выходишь, Боже, с войсками нашими?</rus>
	</verse>
	<verse nr="12">
		<slav>
			<num>Gi</num> Дaждь нaмъ п0мощь t ск0рби: и3 сyетно спасeніе человёческо.</slav>
		<rus>Подай нам помощь в тесноте, ибо защита человеческая суетна.</rus>
	</verse>
	<verse nr="13">
		<slav>
			<num>д7i</num> Њ бз7э сотвори1мъ си1лу: и3 т0й ўничижи1тъ стужaющыz нaмъ.</slav>
		<rus>С Богом мы окажем силу, Он низложит врагов наших.</rus>
	</verse>
</psalm>
