<?xml version="1.0" encoding="Windows-1251"?>
<!DOCTYPE psalm SYSTEM "psalm.dtd">
<?xml-stylesheet type="text/xsl" href="Page.xsl"?>
<psalm nr="84">
	<title>
		<num>№</num> Въ конeцъ, сынHмъ корewвымъ, pал0мъ, <num>п7д</num>.</title>
	<verse nr="1">
		<slav>
			<initial>Б</initial>lговоли1лъ є3си2, гDи, зeмлю твою2, возврати1лъ є3си2 плёнъ їaкwвль.</slav>
		<rus>Господи! Ты умилосердился к земле Твоей, возвратил плен Иакова;</rus>
	</verse>
	<verse nr="2">
		<slav>
			<num>G</num> Њстaвилъ є3си2 беззакHніz людjй твои1хъ, покрhлъ є3си2 вс‰ грэхи2 и4хъ.</slav>
		<rus>простил беззаконие народа Твоего, покрыл все грехи его,</rus>
	</verse>
	<verse nr="3">
		<slav>
			<num>д7</num> Ўкроти1лъ є3си2 вeсь гнёвъ тв0й, возврати1лсz є3си2 t гнёва ћрости твоеS.</slav>
		<rus>отъял всю ярость Твою, отвратил лютость гнева Твоего.</rus>
	</verse>
	<verse nr="4">
		<slav>
			<num>є7</num> Возврати2 нaсъ, б9е спcній нaшихъ, и3 tврати2 ћрость твою2 t нaсъ.</slav>
		<rus>Восстанови нас, Боже спасения нашего, и прекрати негодование Твое на нас.</rus>
	</verse>
	<verse nr="5">
		<slav>
			<num>ѕ7</num> Е#дA во вёки прогнёваешисz на ны2; и3ли2 прострeши гнёвъ тв0й t р0да въ р0дъ;</slav>
		<rus>Неужели вечно будешь гневаться на нас, прострешь гнев Твой от рода в род?</rus>
	</verse>
	<verse nr="6">
		<slav>
			<num>з7</num> Б9е, ты2 њбрaщьсz њживи1ши ны2, и3 лю1діе твои2 возвеселsтсz њ тебЁ.</slav>
		<rus>Неужели снова не оживишь нас, чтобы народ Твой возрадовался о Тебе?</rus>
	</verse>
	<verse nr="7">
		<slav>
			<num>}</num> Kви2 нaмъ, гDи, млcть твою2, и3 спcніе твоE дaждь нaмъ.</slav>
		<rus>Яви нам, Господи, милость Твою, и спасение Твое даруй нам.</rus>
	</verse>
	<verse nr="8">
		<slav>
			<num>f7</num> Ўслhшу, что2 речeтъ њ мнЁ гDь бGъ: ћкw речeтъ ми1ръ на лю1ди сво‰, и3 на прпdбныz сво‰, и3 на њбращaющыz сердцA къ немY.</slav>
		<rus>Послушаю, что скажет Господь Бог. Он скажет мир народу Своему и избранным Своим, но да не впадут они снова в безрассудство.</rus>
	</verse>
	<verse nr="9">
		<slav>
			<num>‹</num> Nбaче бли1з8 боsщихсz є3гw2 спcніе є3гw2, всели1ти слaву въ зeмлю нaшу.</slav>
		<rus>Так, близко к боящимся Его спасение Его, чтобы обитала слава в земле нашей!</rus>
	</verse>
	<verse nr="10">
		<slav>
			<num>№i</num> Млcть и3 и4стина срэт0стэсz, прaвда и3 ми1ръ њблобызaстасz:</slav>
		<rus>Милость и истина сретятся, правда и мир облобызаются;</rus>
	</verse>
	<verse nr="11">
		<slav>
			<num>в7i</num> и4стина t земли2 возсіz, и3 прaвда съ нб7сE прини1че:</slav>
		<rus>истина возникнет из земли, и правда приникнет с небес;</rus>
	</verse>
	<verse nr="12">
		<slav>
			<num>Gi</num> и4бо гDь дaстъ бlгость, и3 землS нaша дaстъ пл0дъ св0й.</slav>
		<rus>и Господь даст благо, и земля наша даст плод свой;</rus>
	</verse>
	<verse nr="13">
		<slav>
			<num>д7i</num> Прaвда пред8 ни1мъ пред8и1детъ, и3 положи1тъ въ пyть стwпы2 сво‰.</slav>
		<rus>правда пойдет пред Ним и поставит на путь стопы свои.</rus>
	</verse>
</psalm>
