<?xml version="1.0" encoding="Windows-1251"?>
<!DOCTYPE psalm SYSTEM "psalm.dtd">
<?xml-stylesheet type="text/xsl" href="Page.xsl"?>
<psalm nr="33">
	<title>
		<num>№</num> Pал0мъ дв7ду, внегдA и3змэни2 лицE своE пред8 ґвімелeхомъ: и3 tпусти2 є3го2, и3 tи1де, <num>lг</num>.</title>
	<verse nr="1">
		<slav>
			<initial>Б</initial>лагословлю2 гDа на всsкое врeмz, вhну хвалA є3гw2 во ўстёхъ мои1хъ.</slav>
		<rus>Благословлю Господа во всякое время; хвала Ему непрестанно в устах моих.</rus>
	</verse>
	<verse nr="2">
		<slav>
			<num>G</num> Њ гDэ похвaлитсz душA моS: да ўслhшатъ кр0тцыи и3 возвеселsтсz.</slav>
		<rus>Господом будет хвалиться душа моя; услышат кроткие и возвеселятся.</rus>
	</verse>
	<verse nr="3">
		<slav>
			<num>д7</num> Возвели1чите гDа со мн0ю, и3 вознесeмъ и4мz є3гw2 вкyпэ.</slav>
		<rus>Величайте Господа со мною, и превознесем имя Его вместе.</rus>
	</verse>
	<verse nr="4">
		<slav>
			<num>є7</num> Взыскaхъ гDа, и3 ўслhша мS и3 t всёхъ скорбeй мои1хъ и3збaви мS. </slav>
		<rus>Я взыскал Господа, и Он услышал меня, и от всех опасностей моих избавил меня.</rus>
	</verse>
	<verse nr="5">
		<slav>
			<num>ѕ7</num> Приступи1те къ немY и3 просвэти1тесz, и3 ли1ца в†ша не постыдsтсz. </slav>
		<rus>Кто обращал взор к Нему, те просвещались, и лица их не постыдятся.</rus>
	</verse>
	<verse nr="6">
		<slav>
			<num>з7</num> Сeй ни1щій воззвA, и3 гDь ўслhша и5, и3 t всёхъ скорбeй є3гw2 сп7сE и5.</slav>
		<rus>Сей нищий воззвал, - и Господь услышал и спас его от всех бед его.</rus>
	</verse>
	<verse nr="7">
		<slav>
			<num>}</num> Њполчи1тсz ѓгGлъ гDень w4крестъ боsщихсz є3гw2 и3 и3збaвитъ и5хъ.</slav>
		<rus>Ангел Господень ополчается вокруг боящихся Его и избавляет их.</rus>
	</verse>
	<verse nr="8">
		<slav>
			<num>f7</num> Вкуси1те и3 ви1дите, ћкw бlгъ гDь: бlжeнъ мyжъ, и4же ўповaетъ нaнь.  </slav>
		<rus>Вкусите, и увидите, как благ Господь! Блажен человек, который уповает на Него!</rus>
	</verse>
	<verse nr="9">
		<slav>
			<num>‹</num> Б0йтесz гDа, вси2 с™jи є3гw2, ћкw нёсть лишeніz боsщымсz є3гw2.</slav>
		<rus>Бойтесь Господа, [все] святые Его, ибо нет скудости у боящихся Его.</rus>
	</verse>
	<verse nr="10">
		<slav>
			<num>№i</num> Богaтіи њбнищaша и3 взалкaша: взыскaющіи же гDа не лишaтсz всsкагw блaга.</slav>
		<rus>Скимны бедствуют и терпят голод, а ищущие Господа не терпят нужды ни в каком благе.</rus>
	</verse>
	<verse nr="11">
		<slav>
			<num>в7i</num> Пріиди1те, ч†да, послyшайте менє2, стрaху гDню научY вaсъ.</slav>
		<rus>Придите, дети, послушайте меня: страху Господню научу вас.</rus>
	</verse>
	<verse nr="12">
		<slav>
			<num>Gi</num> Кт0 є3сть человёкъ хотsй жив0тъ, любsй дни6 ви1дэти блaги;</slav>
		<rus>Хочет ли человек жить и любит ли долгоденствие, чтобы видеть благо?</rus>
	</verse>
	<verse nr="13">
		<slav>
			<num>д7i</num> Ўдержи2 z3зhкъ тв0й t ѕлA и3 ўстнЁ твои2, є4же не глаг0лати льсти2.</slav>
		<rus>Удерживай язык свой от зла и уста свои от коварных слов.</rus>
	</verse>
	<verse nr="14">
		<slav>
			<num>є7i</num> Ўклони1сz t ѕлA и3 сотвори2 блaго: взыщи2 ми1ра и3 пожени2 и5.</slav>
		<rus>Уклоняйся от зла и делай добро; ищи мира и следуй за ним.</rus>
	</verse>
	<verse nr="15">
		<slav>
			<num>ѕ7i</num> Џчи гDни на првdныz, и3 ќши є3гw2 въ моли1тву и4хъ.</slav>
		<rus>Очи Господни обращены на праведников, и уши Его - к воплю их.</rus>
	</verse>
	<verse nr="16">
		<slav>
			<num>з7i</num> Лицe же гDне на творsщыz ѕл†z, є4же потреби1ти t земли2 пaмzть и4хъ.</slav>
		<rus>Но лице Господне против делающих зло, чтобы истребить с земли память о них.</rus>
	</verse>
	<verse nr="17">
		<slav>
			<num>}i</num> Воззвaша првdніи, и3 гDь ўслhша и5хъ и3 t всёхъ скорбeй и4хъ и3збaви и5хъ.</slav>
		<rus>Взывают [праведные], и Господь слышит, и от всех скорбей их избавляет их.</rus>
	</verse>
	<verse nr="18">
		<slav>
			<num>f7i</num> Бли1з8 гDь сокрушeнныхъ сeрдцемъ, и3 смирє1нныz дyхомъ сп7сeтъ.</slav>
		<rus>Близок Господь к сокрушенным сердцем и смиренных духом спасет.</rus>
	</verse>
	<verse nr="19">
		<slav>
			<num>к7</num> МнHги скHрби првdнымъ, и3 t всёхъ и4хъ и3збaвитъ | гDь.</slav>
		<rus>Много скорбей у праведного, и от всех их избавит его Господь.</rus>
	</verse>
	<verse nr="20">
		<slav>
			<num>к7а</num> Храни1тъ гDь вс‰ кHсти и4хъ, ни є3ди1на t ни1хъ сокруши1тсz.</slav>
		<rus>Он хранит все кости его; ни одна из них не сокрушится.</rus>
	</verse>
	<verse nr="21">
		<slav>
			<num>к7в</num> Смeрть грёшникwвъ лютA, и3 ненави1дzщіи првdнаго прегрэшaтъ.</slav>
		<rus>Убьет грешника зло, и ненавидящие праведного погибнут.</rus>
	</verse>
	<verse nr="22">
		<slav>
			<num>к7г</num> И#збaвитъ гDь дyшы р†бъ свои1хъ, и3 не прегрэшaтъ вси2 ўповaющіи на него2.</slav>
		<rus>Избавит Господь душу рабов Своих, и никто из уповающих на Него не погибнет.</rus>
	</verse>
</psalm>
