<?xml version="1.0" encoding="Windows-1251"?>
<!DOCTYPE psalm SYSTEM "psalm.dtd">
<?xml-stylesheet type="text/xsl" href="Page.xsl"?>
<psalm nr="124">
	<title>Пёснь степeней, <num>рк7д</num>.</title>
	<verse nr="1">
		<slav>
			<initial>Н</initial>адёющіисz на гDа, ћкw горA сіHнъ: не подви1житсz въ вёкъ живhй во їерcли1мэ.</slav>
		<rus>Надеющийся на Господа, как гора Сион, не подвигнется: пребывает вовек.</rus>
	</verse>
	<verse nr="2">
		<slav>
			<num>в7</num> Г0ры w4крестъ є3гw2, и3 гDь w4крестъ людjй свои1хъ, tнн7э и3 до вёка.</slav>
		<rus>Горы окрест Иерусалима, а Господь окрест народа Своего отныне и вовек.</rus>
	</verse>
	<verse nr="3">
		<slav>
			<num>G</num> Ћкw не њстaвитъ гDь жезлA грёшныхъ на жрeбій првdныхъ, ћкw да не пр0струтъ првdніи въ беззакHніz рyкъ свои1хъ.</slav>
		<rus>Ибо не оставит [Господь] жезла нечестивых над жребием праведных, дабы праведные не простерли рук своих к беззаконию.</rus>
	</verse>
	<verse nr="4">
		<slav>
			<num>д7</num> Ўбlжи2, гDи, бlг‡z и3 пр†выz срdцемъ. </slav>
		<rus>Благотвори, Господи, добрым и правым в сердцах своих;</rus>
	</verse>
	<verse nr="5">
		<slav>
			<num>є7</num> Ўклонsющыzсz же въ развращє1ніz tведeтъ гDь съ дёлающими беззак0ніе: ми1ръ на ї}лz.</slav>
		<rus>а совращающихся на кривые пути свои да оставит Господь ходить с делающими беззаконие. Мир на Израиля!</rus>
	</verse>
</psalm>
