<?xml version="1.0" encoding="Windows-1251"?>
<!DOCTYPE psalm SYSTEM "psalm.dtd">
<?xml-stylesheet type="text/xsl" href="Page.xsl"?>
<psalm nr="53">
	<title>
		<num>№</num> Въ конeцъ, въ пёснехъ рaзума дв7ду, </title>
	<verse nr="1">
		<slav>
			<num>в7</num> внегдA пріити2  зіфeємъ и3 рещи2 саyлови: не сe ли, дв7дъ скрhсz въ нaсъ; <num>н7г</num>.</slav>
		<rus>когда пришли Зифеи и сказали Саулу: "не у нас ли скрывается Давид?"</rus>
	</verse>
	<verse nr="2">
		<slav>
			<initial>Б</initial>9е, во и4мz твоE сп7си1 мz и3 въ си1лэ твоeй суди1 ми.</slav>
		<rus>Боже! именем Твоим спаси меня, и силою Твоею суди меня.</rus>
	</verse>
	<verse nr="3">
		<slav>
			<num>д7</num> Б9е, ўслhши моли1тву мою2, внуши2 глаг0лы ќстъ мои1хъ:</slav>
		<rus>Боже! услышь молитву мою, внемли словам уст моих,</rus>
	</verse>
	<verse nr="4">
		<slav>
			<num>є7</num> ћкw чyждіи востaша на мS, и3 крёпцыи взыскaша дyшу мою2, и3 не предложи1ша бGа пред8 соб0ю.</slav>
		<rus>ибо чужие восстали на меня, и сильные ищут души моей; они не имеют Бога пред собою.</rus>
	</verse>
	<verse nr="5">
		<slav>
			<num>ѕ7</num> Сe бо, бGъ помогaетъ ми2, и3 гDь застyпникъ души2 моeй:</slav>
		<rus>Вот, Бог помощник мой; Господь подкрепляет душу мою.</rus>
	</verse>
	<verse nr="6">
		<slav>
			<num>з7</num> tврати1тъ ѕл†z врагHмъ мои6мъ: и4стиною твоeю потреби2 и5хъ.</slav>
		<rus>Он воздаст за зло врагам моим; истиною Твоею истреби их.</rus>
	</verse>
	<verse nr="7">
		<slav>
			<num>}</num> В0лею пожрY тебЁ, и3сповёмсz и4мени твоемY, гDи, ћкw бlго:</slav>
		<rus>Я усердно принесу Тебе жертву, прославлю имя Твое, Господи, ибо оно благо,</rus>
	</verse>
	<verse nr="8">
		<slav>
			<num>f7</num> ћкw t всsкіz печaли и3збaвилъ мS є3си2, и3 на враги2 мо‰ воззрЁ џко моE.</slav>
		<rus>ибо Ты избавил меня от всех бед, и на врагов моих смотрело око мое.</rus>
	</verse>
</psalm>
