<?xml version="1.0" encoding="Windows-1251"?>
<!DOCTYPE psalm SYSTEM "psalm.dtd">
<?xml-stylesheet type="text/xsl" href="Page.xsl"?>
<psalm nr="94">
	<title>ХвалA пёсни дв7ду, не надпи1санъ ў є3врє1й, <num>§д</num>.</title>
	<verse nr="1">
		<slav>
			<initial>П</initial>ріиди1те, возрaдуемсz гDеви, воскли1кнемъ бGу сп7си1телю нaшему:</slav>
		<rus>Приидите, воспоем Господу, воскликнем [Богу], твердыне спасения нашего;</rus>
	</verse>
	<verse nr="2">
		<slav>
			<num>в7</num> предвари1мъ лицE є3гw2 во и3сповёданіи, и3 во pалмёхъ воскли1кнемъ є3мY:</slav>
		<rus>предстанем лицу Его со славословием, в песнях воскликнем Ему,</rus>
	</verse>
	<verse nr="3">
		<slav>
			<num>G</num> ћкw бGъ вeлій гDь, и3 цRь вeлій по всeй земли2:</slav>
		<rus>ибо Господь есть Бог великий и Царь великий над всеми богами.</rus>
	</verse>
	<verse nr="4">
		<slav>
			<num>д7</num> ћкw въ руцЁ є3гw2 вси2 концы6 земли2, и3 высwты2 г0ръ тогw2 сyть.</slav>
		<rus>В Его руке глубины земли, и вершины гор - Его же;</rus>
	</verse>
	<verse nr="5">
		<slav>
			<num>є7</num> Ћкw тогw2 є4сть м0ре, и3 т0й сотвори2 є5, и3 сyшу рyцэ є3гw2 создaстэ.</slav>
		<rus>Его - море, и Он создал его, и сушу образовали руки Его.</rus>
	</verse>
	<verse nr="6">
		<slav>
			<num>ѕ7</num> Пріиди1те, поклони1мсz и3 припадeмъ є3мY, и3 восплaчемсz пред8 гDемъ сотв0ршимъ нaсъ:</slav>
		<rus>Приидите, поклонимся и припадем, преклоним колени пред лицем Господа, Творца нашего;</rus>
	</verse>
	<verse nr="7">
		<slav>
			<num>з7</num> ћкw т0й є4сть бGъ нaшъ, и3 мы2 лю1діе пaжити є3гw2 и3 џвцы руки2 є3гw2. Днeсь ѓще глaсъ є3гw2 ўслhшите,</slav>
		<rus>ибо Он есть Бог наш, и мы - народ паствы Его и овцы руки Его. О, если бы вы ныне послушали гласа Его:</rus>
	</verse>
	<verse nr="8">
		<slav>
			<num>}</num> не њжесточи1те сердeцъ вaшихъ, ћкw въ прогнёваніи, по дни2 и3скушeніz въ пустhни:</slav>
		<rus>"не ожесточите сердца вашего, как в Мериве, как в день искушения в пустыне,</rus>
	</verse>
	<verse nr="9">
		<slav>
			<num>f7</num> въ џньже (и3дёже) и3скуси1ша мS nтцы2 вaши, и3скуси1ша мS, и3 ви1дэша дэлA мо‰.</slav>
		<rus>где искушали Меня отцы ваши, испытывали Меня, и видели дело Мое.</rus>
	</verse>
	<verse nr="10">
		<slav>
			<num>‹</num> Четhредесzть лётъ негодовaхъ р0да тогw2, и3 рёхъ: прcнw заблуждaютъ сeрдцемъ, тjи же не познaша путjй мои1хъ:</slav>
		<rus>Сорок лет Я был раздражаем родом сим, и сказал: это народ, заблуждающийся сердцем; они не познали путей Моих,</rus>
	</verse>
	<verse nr="11">
		<slav>
			<num>№i</num> ћкw клsхсz во гнёвэ моeмъ, ѓще вни1дутъ въ пок0й м0й.</slav>
		<rus>и потому Я поклялся во гневе Моем, что они не войдут в покой Мой".</rus>
	</verse>
</psalm>
