<?xml version="1.0" encoding="Windows-1251"?>
<!DOCTYPE psalm SYSTEM "psalm.dtd">
<?xml-stylesheet type="text/xsl" href="Page.xsl"?>
<psalm nr="71">
	<title>Њ соломHнэ, pал0мъ дв7ду, <num>о7а</num>.</title>
	<verse nr="1">
		<slav>
			<initial>Б</initial>9е, сyдъ тв0й царeви дaждь, и3 прaвду твою2 сhну царeву:</slav>
		<rus>Боже! даруй царю Твой суд и сыну царя Твою правду,</rus>
	</verse>
	<verse nr="2">
		<slav>
			<num>в7</num> суди1ти лю1демъ твои6мъ въ прaвдэ и3 ни1щымъ твои6мъ въ судЁ.</slav>
		<rus>да судит праведно людей Твоих и нищих Твоих на суде;</rus>
	</verse>
	<verse nr="3">
		<slav>
			<num>G</num> Да воспріи1мутъ г0ры ми1ръ лю1демъ и3 х0лми прaвду.</slav>
		<rus>да принесут горы мир людям и холмы правду;</rus>
	</verse>
	<verse nr="4">
		<slav>
			<num>д7</num> Сyдитъ ни1щымъ людски6мъ, и3 спасeтъ сhны ўб0гихъ, и3 смири1тъ клеветникA.</slav>
		<rus>да судит нищих народа, да спасет сынов убогого и смирит притеснителя, -</rus>
	</verse>
	<verse nr="5">
		<slav>
			<num>є7</num> И# пребyдетъ съ с0лнцемъ, и3 прeжде луны2 р0да родHвъ.</slav>
		<rus>и будут бояться Тебя, доколе пребудут солнце и луна, в роды родов.</rus>
	</verse>
	<verse nr="6">
		<slav>
			<num>ѕ7</num> Сни1детъ ћкw д0ждь на руно2, и3 ћкw кaплz кaплющаz на зeмлю.</slav>
		<rus>Он сойдет, как дождь на скошенный луг, как капли, орошающие землю;</rus>
	</verse>
	<verse nr="7">
		<slav>
			<num>з7</num> Возсіsетъ во днeхъ є3гw2 прaвда и3 мн0жество ми1ра, д0ндеже tи1метсz лунA.</slav>
		<rus>во дни его процветет праведник, и будет обилие мира, доколе не престанет луна;</rus>
	</verse>
	<verse nr="8">
		<slav>
			<num>}</num> И# њбладaетъ t м0рz до м0рz, и3 t рёкъ до конє1цъ вселeнныz.</slav>
		<rus>он будет обладать от моря до моря и от реки до концов земли;</rus>
	</verse>
	<verse nr="9">
		<slav>
			<num>f7</num> Пред8 ни1мъ припадyтъ є3fі0плzне, и3 врази2 є3гw2 пeрсть поли1жутъ.</slav>
		<rus>падут пред ним жители пустынь, и враги его будут лизать прах;</rus>
	</verse>
	<verse nr="10">
		<slav>
			<num>‹</num> Цaріе fарсjйстіи и3 џстрови дaры принесyтъ, цaріе ґрaвстіи и савA дaры приведyтъ:</slav>
		<rus>цари Фарсиса и островов поднесут ему дань; цари Аравии и Савы принесут дары;</rus>
	</verse>
	<verse nr="11">
		<slav>
			<num>№i</num> и3 покл0нzтсz є3мY вси2 цaріе зeмстіи, вси2 kзhцы пораб0таютъ є3мY.</slav>
		<rus>и поклонятся ему все цари; все народы будут служить ему;</rus>
	</verse>
	<verse nr="12">
		<slav>
			<num>в7i</num> Ћкw и3збaви ни1ща t си1льна, и3 ўб0га, є3мyже не бЁ пом0щника.</slav>
		<rus>ибо он избавит нищего, вопиющего и угнетенного, у которого нет помощника.</rus>
	</verse>
	<verse nr="13">
		<slav>
			<num>Gi</num> Пощади1тъ ни1ща и3 ўб0га, и3 дyшы ўб0гихъ спасeтъ:</slav>
		<rus>Будет милосерд к нищему и убогому, и души убогих спасет;</rus>
	</verse>
	<verse nr="14">
		<slav>
			<num>д7i</num> t ли1хвы  и3 t непрaвды и3збaвитъ дyшы и4хъ, и3 чeстно и4мz є3гw2 пред8 ни1ми.</slav>
		<rus>от коварства и насилия избавит души их, и драгоценна будет кровь их пред очами его;</rus>
	</verse>
	<verse nr="15">
		<slav>
			<num>є7i</num> И# жи1въ бyдетъ, и3 дaстсz є3мY t злaта ґравjйска: и3 пом0лzтсz њ нeмъ вhну, вeсь дeнь благословsтъ є3го2.</slav>
		<rus>и будет жить, и будут давать ему от золота Аравии, и будут молиться о нем непрестанно, всякий день благословлять его;</rus>
	</verse>
	<verse nr="16">
		<slav>
			<num>ѕ7i</num> Бyдетъ ўтверждeніе на земли2 на версёхъ г0ръ: превознесeтсz пaче лівaна пл0дъ є3гw2, и3 процвэтyтъ t грaда ћкw травA земнaz.</slav>
		<rus>будет обилие хлеба на земле, наверху гор; плоды его будут волноваться, как лес на Ливане, и в городах размножатся люди, как трава на земле;</rus>
	</verse>
	<verse nr="17">
		<slav>
			<num>з7i</num> Бyдетъ и4мz є3гw2 благословeно во вёки, прeжде с0лнца пребывaетъ и4мz є3гw2: и3 благословsтсz въ нeмъ вс‰ кwлёна земнaz, вси2 kзhцы ўблажaтъ є3го2.</slav>
		<rus>будет имя его [благословенно] вовек; доколе пребывает солнце, будет передаваться имя его; и благословятся в нем [все племена земные], все народы ублажат его.</rus>
	</verse>
	<verse nr="18">
		<slav>
			<num>}i</num> Блгcвeн гDь бGъ ї}левъ, творsй чудесA є3ди1нъ,</slav>
		<rus>Благословен Господь Бог, Бог Израилев, един творящий чудеса,</rus>
	</verse>
	<verse nr="19">
		<slav>
			<num>f7i</num> и3 блгcвeно и4мz слaвы є3гw2 во вёкъ и3 въ вёкъ вёка: и3 и3сп0лнитсz слaвы є3гw2 всS землS: бyди, бyди.</slav>
		<rus>и благословенно имя славы Его вовек, и наполнится славою Его вся земля. Аминь и аминь.</rus>
	</verse>
</psalm>
