<?xml version="1.0" encoding="Windows-1251"?>
<!DOCTYPE psalm SYSTEM "psalm.dtd">
<?xml-stylesheet type="text/xsl" href="Page.xsl"?>
<psalm nr="139">
	<title>Въ конeцъ, pал0мъ дв7ду, <num>рlf</num>.</title>
	<verse nr="1">
		<slav>
			<initial>И#</initial>зми1 мz, гDи, t человёка лукaва, t мyжа непрaведна и3збaви мS:</slav>
		<rus>Избавь меня, Господи, от человека злого; сохрани меня от притеснителя:</rus>
	</verse>
	<verse nr="2">
		<slav>
			<num>в7</num> иже помhслиша непрaвду въ сeрдцы, вeсь дeнь њполчaху бр†ни:</slav>
		<rus>они злое мыслят в сердце, всякий день ополчаются на брань,</rus>
	</verse>
	<verse nr="3">
		<slav>
			<num>G</num> и3з8wстри1ша z3зhкъ св0й ћкw ѕміи1нъ: ћдъ ѓспідовъ под8 ўстнaми и4хъ. </slav>
		<rus>изощряют язык свой, как змея; яд аспида под устами их.</rus>
	</verse>
	<verse nr="4">
		<slav>
			<num>д7</num> Сохрани1 мz, гDи, и3з8 руки2 грёшничи, t человBкъ непрaведныхъ и3зми1 мz, и5же помhслиша запsти стwпы2 мо‰.</slav>
		<rus>Соблюди меня, Господи, от рук нечестивого, сохрани меня от притеснителей, которые замыслили поколебать стопы мои.</rus>
	</verse>
	<verse nr="5">
		<slav>
			<num>є7</num> Скрhша г0рдіи сёть мнЁ и3 ќжы, препsша сёть ногaма мои1ма:</slav>
		<rus>Гордые скрыли силки для меня и петли, раскинули сеть по дороге, тенета разложили для меня.</rus>
	</verse>
	<verse nr="6">
		<slav>
			<num>ѕ7</num> при стези2 соблaзны положи1ша ми2.</slav>
		<rus>Я сказал Господу: Ты Бог мой; услышь, Господи, голос молений моих!</rus>
	</verse>
	<verse nr="7">
		<slav>
			<num>з7</num> Рёхъ гDеви: бGъ м0й є3си2 ты2, внуши2, гDи, глaсъ молeніz моегw2.</slav>
		<rus>Господи, Господи, сила спасения моего! Ты покрыл голову мою в день брани.</rus>
	</verse>
	<verse nr="8">
		<slav>
			<num>}</num> ГDи, гDи, си1ло спcніz моегw2, њсэни1лъ є3си2 над8 глав0ю моeю въ дeнь брaни.</slav>
		<rus>Не дай, Господи, желаемого нечестивому; не дай успеха злому замыслу его: они возгордятся.</rus>
	</verse>
	<verse nr="9">
		<slav>
			<num>f7</num> Не предaждь менE, гDи, t желaніz моегw2 грёшнику: помhслиша на мS, не њстaви менE, да не когдA вознесyтсz.</slav>
		<rus>Да покроет головы окружающих меня зло собственных уст их.</rus>
	</verse>
	<verse nr="10">
		<slav>
			<num>‹</num> ГлавA њкружeніz и4хъ, трyдъ ўстeнъ и4хъ покрhетъ |.</slav>
		<rus>Да падут на них горящие угли; да будут они повержены в огонь, в пропасти, так, чтобы не встали.</rus>
	</verse>
	<verse nr="11">
		<slav>
			<num>№i</num> Падyтъ на ни1хъ ќгліz џгнєннаz, низложи1ши | во страстeхъ, и3 не постоsтъ.</slav>
		<rus>Человек злоязычный не утвердится на земле; зло увлечет притеснителя в погибель.</rus>
	</verse>
	<verse nr="12">
		<slav>
			<num>в7i</num> Мyжъ z3зhченъ не и3спрaвитсz на земли2: мyжа непрaведна ѕл†z ўловsтъ во и3стлёніе.</slav>
		<rus>Знаю, что Господь сотворит суд угнетенным и справедливость бедным.</rus>
	</verse>
	<verse nr="13">
		<slav>
			<num>Gi</num> Познaхъ, ћкw сотвори1тъ гDь сyдъ ни1щымъ и3 мeсть ўбHгимъ.</slav>
		<rus>Так! праведные будут славить имя Твое; непорочные будут обитать пред лицем Твоим.</rus>
	</verse>
	<verse nr="14">
		<slav>
			<num>д7i</num> Nбaче првdніи и3сповёдzтсz и4мени твоемY, и3 вселsтсz прaвіи съ лицeмъ твои1мъ.</slav>
		<rus>Так! праведные будут славить имя Твое; непорочные будут обитать пред лицем Твоим.</rus>
	</verse>
</psalm>
