<?xml version="1.0" encoding="Windows-1251"?>
<!DOCTYPE psalm SYSTEM "psalm.dtd">
<?xml-stylesheet type="text/xsl" href="Page.xsl"?>
<psalm nr="134">
	<title>А#ллилyіа, <num>рlд</num>.</title>
	<verse nr="1">
		<slav>
			<initial>Х</initial>вали1те и4мz гDне, хвали1те, раби2 гDа,</slav>
		<rus>Хвалите имя Господне, хвалите, рабы Господни,</rus>
	</verse>
	<verse nr="2">
		<slav>
			<num>в7</num> стоsщіи во хрaмэ гDни, во дв0рэхъ д0му бGа нaшегw.</slav>
		<rus>стоящие в доме Господнем, во дворах дома Бога нашего.</rus>
	</verse>
	<verse nr="3">
		<slav>
			<num>G</num> Хвали1те гDа, ћкw блaгъ гDь: п0йте и4мени є3гw2, ћкw добро2:</slav>
		<rus>Хвалите Господа, ибо Господь благ; пойте имени Его, ибо это сладостно,</rus>
	</verse>
	<verse nr="4">
		<slav>
			<num>д7</num> ћкw їaкwва и3збрA себЁ гDь, ї}лz въ достоsніе себЁ:</slav>
		<rus>ибо Господь избрал Себе Иакова, Израиля в собственность Свою.</rus>
	</verse>
	<verse nr="5">
		<slav>
			<num>є7</num> ћкw ѓзъ познaхъ, ћкw вeлій гDь, и3 гDь нaшъ над8 всёми бHги:</slav>
		<rus>Я познал, что велик Господь, и Господь наш превыше всех богов.</rus>
	</verse>
	<verse nr="6">
		<slav>
			<num>ѕ7</num> вс‰, є3ли6ка восхотЁ гDь, сотвори2 на нб7си2 и3 на земли2, въ морsхъ и3 во всёхъ бeзднахъ.</slav>
		<rus>Господь творит все, что хочет, на небесах и на земле, на морях и во всех безднах;</rus>
	</verse>
	<verse nr="7">
		<slav>
			<num>з7</num> ВозводS w4блаки t послёднихъ земли2, мHлніи въ д0ждь сотвори2, и3зводsй вётры t сокр0вищъ свои1хъ.</slav>
		<rus>возводит облака от края земли, творит молнии при дожде, изводит ветер из хранилищ Своих.</rus>
	</verse>
	<verse nr="8">
		<slav>
			<num>}</num> И$же порази2 пeрвенцы є3гЂпєтскіz t человёка до скотA:</slav>
		<rus>Он поразил первенцев Египта, от человека до скота,</rus>
	</verse>
	<verse nr="9">
		<slav>
			<num>f7</num> послA знaмєніz и3 чудесA посредЁ тебє2, є3гЂпте, на фараHна и3 на вс‰ рабы6 є3гw2.</slav>
		<rus>послал знамения и чудеса среди тебя, Египет, на фараона и на всех рабов его,</rus>
	</verse>
	<verse nr="10">
		<slav>
			<num>‹</num> И$же порази2 kзhки мнHги и3 и3зби2 цари6 крBпки:</slav>
		<rus>поразил народы многие и истребил царей сильных:</rus>
	</verse>
	<verse nr="11">
		<slav>
			<num>№i</num> сиHна царS ґморрeйска и3 w4га царS васaнска, и3 вс‰ ц†рствіz хана†нска:</slav>
		<rus>Сигона, царя Аморрейского, и Ога, царя Васанского, и все царства Ханаанские;</rus>
	</verse>
	<verse nr="12">
		<slav>
			<num>в7i</num> и3 дадE зeмлю и4хъ достоsніе, достоsніе ї}лю лю1демъ свои6мъ.</slav>
		<rus>и отдал землю их в наследие, в наследие Израилю, народу Своему.</rus>
	</verse>
	<verse nr="13">
		<slav>
			<num>Gi</num> ГDи, и4мz твоE въ вёкъ, и3 пaмzть твоS въ р0дъ и3 р0дъ:</slav>
		<rus>Господи! имя Твое вовек; Господи! память о Тебе в род и род.</rus>
	</verse>
	<verse nr="14">
		<slav>
			<num>д7i</num> ћкw суди1ти и4мать гDь лю1демъ свои6мъ, и3 њ рабёхъ свои1хъ ўм0литсz.</slav>
		<rus>Ибо Господь будет судить народ Свой и над рабами Своими умилосердится.</rus>
	</verse>
	<verse nr="15">
		<slav>
			<num>є7i</num> Јдwли kзы6къ сребро2 и3 злaто, дэлA рyкъ человёческихъ:</slav>
		<rus>Идолы язычников - серебро и золото, дело рук человеческих:</rus>
	</verse>
	<verse nr="16">
		<slav>
			<num>ѕ7i</num> ўстA и4мутъ, и3 не возглаг0лютъ: џчи и4мутъ, и3 не ќзрzтъ:</slav>
		<rus>есть у них уста, но не говорят; есть у них глаза, но не видят;</rus>
	</verse>
	<verse nr="17">
		<slav>
			<num>з7i</num> ќши и4мутъ, и3 не ўслhшатъ: нижe бо є4сть дyхъ во ўстёхъ и4хъ.</slav>
		<rus>есть у них уши, но не слышат, и нет дыхания в устах их.</rus>
	</verse>
	<verse nr="18">
		<slav>
			<num>}i</num> Под0бни и5мъ да бyдутъ творsщіи | и3 вси2 надёющіисz на нS.</slav>
		<rus>Подобны им будут делающие их и всякий, кто надеется на них.</rus>
	</verse>
	<verse nr="19">
		<slav>
			<num>f7i</num> Д0ме ї}левъ, благослови1те гDа: д0ме ґарHнь, благослови1те гDа: д0ме леvjинъ, благослови1те гDа:</slav>
		<rus>Дом Израилев! благословите Господа. Дом Ааронов! благословите Господа.</rus>
	</verse>
	<verse nr="20">
		<slav>
			<num>к7</num> боsщіисz гDа, благослови1те гDа.</slav>
		<rus>Дом Левиин! благословите Господа. Боящиеся Господа! благословите Господа.</rus>
	</verse>
	<verse nr="21">
		<slav>
			<num>к7а</num> Блгcвeнъ гDь t сіHна, живhй во їерcли1мэ.</slav>
		<rus>Благословен Господь от Сиона, живущий в Иерусалиме! Аллилуия!</rus>
	</verse>
</psalm>
