<?xml version="1.0" encoding="Windows-1251"?>
<!DOCTYPE psalm SYSTEM "psalm.dtd">
<?xml-stylesheet type="text/xsl" href="Page.xsl"?>
<psalm nr="103">
	<title>Pал0мъ дв7ду, њ мірстёмъ бытіи2, <num>Rг</num>.</title>
	<verse nr="1">
		<slav>
			<initial>Б</initial>лагослови2, душE моS, гDа. ГDи б9е м0й, возвели1чилсz є3си2 ѕэлw2: во и3сповёданіе и3 въ велелёпоту њблeклсz є3си2:</slav>
		<rus>Благослови, душа моя, Господа! Господи, Боже мой! Ты дивно велик, Ты облечен славою и величием;</rus>
	</verse>
	<verse nr="2">
		<slav>
			<num>в7</num> њдэsйсz свётомъ ћкw ри1зою, простирazй нeбо ћкw к0жу:</slav>
		<rus>Ты одеваешься светом, как ризою, простираешь небеса, как шатер;</rus>
	</verse>
	<verse nr="3">
		<slav>
			<num>G</num> покрывazй водaми превhспрєннzz сво‰, полагazй w4блаки на восхождeніе своE, ходsй на крил{ вётрєню:</slav>
		<rus>устрояешь над водами горние чертоги Твои, делаешь облака Твоею колесницею, шествуешь на крыльях ветра.</rus>
	</verse>
	<verse nr="4">
		<slav>
			<num>д7</num> творsй ѓгGлы сво‰ дyхи, и3 слуги6 сво‰ плaмень џгненный:</slav>
		<rus>Ты творишь ангелами Твоими духов, служителями Твоими - огонь пылающий.</rus>
	</verse>
	<verse nr="5">
		<slav>
			<num>є7</num> њсновazй зeмлю на твeрди є3S: не преклони1тсz въ вёкъ вёка.</slav>
		<rus>Ты поставил землю на твердых основах: не поколеблется она во веки и веки.</rus>
	</verse>
	<verse nr="6">
		<slav>
			<num>ѕ7</num> Бeздна ћкw ри1за њдэsніе є3S, на горaхъ стaнутъ в0ды:</slav>
		<rus>Бездною, как одеянием, покрыл Ты ее, на горах стоят воды.</rus>
	</verse>
	<verse nr="7">
		<slav>
			<num>з7</num> t запрещeніz твоегw2 побёгнутъ, t глaса гр0ма твоегw2 ўбоsтсz.</slav>
		<rus>От прещения Твоего бегут они, от гласа грома Твоего быстро уходят;</rus>
	</verse>
	<verse nr="8">
		<slav>
			<num>}</num> Восх0дzтъ г0ры, и3 низх0дzтъ полS, въ мёсто є4же њсновaлъ є3си2 и5мъ.</slav>
		<rus>восходят на горы, нисходят в долины, на место, которое Ты назначил для них.</rus>
	</verse>
	<verse nr="9">
		<slav>
			<num>f7</num> Предёлъ положи1лъ є3си2, є3гHже не прeйдутъ, нижE њбратsтсz покрhти зeмлю.</slav>
		<rus>Ты положил предел, которого не перейдут, и не возвратятся покрыть землю.</rus>
	</verse>
	<verse nr="10">
		<slav>
			<num>‹</num> Посылazй и3ст0чники въ дeбрехъ, посредЁ г0ръ пр0йдутъ в0ды.</slav>
		<rus>Ты послал источники в долины: между горами текут [воды],</rus>
	</verse>
	<verse nr="11">
		<slav>
			<num>№i</num> Напаsютъ вс‰ ѕвBри сє1лныz, ждyтъ (воспріи1мутъ) nнaгри въ жaжду свою2.</slav>
		<rus>поят всех полевых зверей; дикие ослы утоляют жажду свою.</rus>
	</verse>
	<verse nr="12">
		<slav>
			<num>в7i</num> На тhхъ пти6цы небє1сныz привитaютъ: t среды2 кaменіz дадsтъ глaсъ.</slav>
		<rus>При них обитают птицы небесные, из среды ветвей издают голос.</rus>
	</verse>
	<verse nr="13">
		<slav>
			<num>Gi</num> Напаszй г0ры t превhспреннихъ свои1хъ: t плодA дёлъ твои1хъ насhтитсz землS.</slav>
		<rus>Ты напояешь горы с высот Твоих, плодами дел Твоих насыщается земля.</rus>
	</verse>
	<verse nr="14">
		<slav>
			<num>д7i</num> Прозzбazй травY скотHмъ, и3 ѕлaкъ на слyжбу человёкwмъ, и3звести2 хлёбъ t земли2:</slav>
		<rus>Ты произращаешь траву для скота, и зелень на пользу человека, чтобы произвести из земли пищу,</rus>
	</verse>
	<verse nr="15">
		<slav>
			<num>є7i</num> и3 віно2 весели1тъ сeрдце человёка, ўмaстити лицE є3лeемъ: и3 хлёбъ сeрдце человёка ўкрэпи1тъ.</slav>
		<rus>и вино, которое веселит сердце человека, и елей, от которого блистает лице его, и хлеб, который укрепляет сердце человека.</rus>
	</verse>
	<verse nr="16">
		<slav>
			<num>ѕ7i</num> Насhтzтсz древA пwльскaz, кeдри лівaнстіи, и5хже є3си2 насади1лъ:</slav>
		<rus>Насыщаются древа Господа, кедры Ливанские, которые Он насадил;</rus>
	</verse>
	<verse nr="17">
		<slav>
			<num>з7i</num> тaмw пти6цы вогнэздsтсz, є3рwдjево жили1ще предводи1телствуетъ и4ми.</slav>
		<rus>на них гнездятся птицы: ели - жилище аисту,</rus>
	</verse>
	<verse nr="18">
		<slav>
			<num>}i</num> Г0ры высHкіz є3лeнємъ, кaмень прибёжище зazцємъ.</slav>
		<rus>высокие горы - сернам; каменные утесы - убежище зайцам.</rus>
	</verse>
	<verse nr="19">
		<slav>
			<num>f7i</num> Сотвори1лъ є4сть лунY во временA: с0лнце познA зaпадъ св0й.</slav>
		<rus>Он сотворил луну для указания времен, солнце знает свой запад.</rus>
	</verse>
	<verse nr="20">
		<slav>
			<num>к7</num> Положи1лъ є3си2 тмY, и3 бhсть н0щь, въ нeйже пр0йдутъ вси2 ѕвёріе дубрaвніи,</slav>
		<rus>Ты простираешь тьму и бывает ночь: во время нее бродят все лесные звери;</rus>
	</verse>
	<verse nr="21">
		<slav>
			<num>к7а</num> скЂмни рыкaющіи восхи1тити и3 взыскaти t бGа пи1щу себЁ.</slav>
		<rus>львы рыкают о добыче и просят у Бога пищу себе.</rus>
	</verse>
	<verse nr="22">
		<slav>
			<num>к7в</num> ВозсіS с0лнце, и3 собрaшасz, и3 въ л0жахъ свои1хъ лsгутъ.</slav>
		<rus>Восходит солнце, [и] они собираются и ложатся в свои логовища;</rus>
	</verse>
	<verse nr="23">
		<slav>
			<num>к7г</num> И#зhдетъ человёкъ на дёло своE и3 на дёланіе своE до вeчера.</slav>
		<rus>выходит человек на дело свое и на работу свою до вечера.</rus>
	</verse>
	<verse nr="24">
		<slav>
			<num>к7д</num> Ћкw возвели1чишасz дэлA тво‰, гDи: вс‰ премdростію сотвори1лъ є3си2: и3сп0лнисz землS твaри твоеS.</slav>
		<rus>Как многочисленны дела Твои, Господи! Все соделал Ты премудро; земля полна произведений Твоих.</rus>
	</verse>
	<verse nr="25">
		<slav>
			<num>к7є</num> СіE м0ре вели1кое и3 прострaнное: тaмw гaди, и4хже нёсть числA, живHтнаz м†лаz съ вели1кими:</slav>
		<rus>Это - море великое и пространное: там пресмыкающиеся, которым нет числа, животные малые с большими;</rus>
	</verse>
	<verse nr="26">
		<slav>
			<num>к7ѕ</num> тaмw корабли6 преплaваютъ, ѕмjй сeй, є3г0же создaлъ є3си2 ругaтисz є3мY.</slav>
		<rus>там плавают корабли, там этот левиафан, которого Ты сотворил играть в нем.</rus>
	</verse>
	<verse nr="27">
		<slav>
			<num>к7з</num> Вс‰ къ тебЁ чaютъ, дaти пи1щу и5мъ во блaго врeмz.</slav>
		<rus>Все они от Тебя ожидают, чтобы Ты дал им пищу их в свое время.</rus>
	</verse>
	<verse nr="28">
		<slav>
			<num>к7и</num> Дaвшу тебЁ и5мъ, соберyтъ: tвeрзшу тебЁ рyку, всsчєскаz и3сп0лнzтсz блaгости:</slav>
		<rus>Даешь им - принимают, отверзаешь руку Твою - насыщаются благом;</rus>
	</verse>
	<verse nr="29">
		<slav>
			<num>к7f</num> tврaщшу же тебЁ лицE, возмzтyтсz: tи1меши дyхъ и4хъ, и3 и3зчeзнутъ и3 въ пeрсть свою2 возвратsтсz:</slav>
		<rus>скроешь лице Твое - мятутся, отнимешь дух их - умирают и в персть свою возвращаются;</rus>
	</verse>
	<verse nr="30">
		<slav>
			<num>l</num> п0слеши д¦а твоего2, и3 сози1ждутсz, и3 њбнови1ши лицE земли2.</slav>
		<rus>пошлешь дух Твой - созидаются, и Ты обновляешь лице земли.</rus>
	</verse>
	<verse nr="31">
		<slav>
			<num>lа</num> Бyди слaва гDнz во вёки: возвесели1тсz гDь њ дёлэхъ свои1хъ:</slav>
		<rus>Да будет Господу слава во веки; да веселится Господь о делах Своих!</rus>
	</verse>
	<verse nr="32">
		<slav>
			<num>lв</num> призирazй на зeмлю и3 творsй ю5 трzсти1сz: прикасazйсz горaмъ, и3 дымsтсz.</slav>
		<rus>Призирает на землю, и она трясется; прикасается к горам, и дымятся.</rus>
	</verse>
	<verse nr="33">
		<slav>
			<num>lг</num> Воспою1 гDеви въ животЁ моeмъ, пою2 бGу моемY, д0ндеже є4смь:</slav>
		<rus>Буду петь Господу во всю жизнь мою, буду петь Богу моему, доколе есмь.</rus>
	</verse>
	<verse nr="34">
		<slav>
			<num>lд</num> да ўслади1тсz є3мY бесёда моS, ѓзъ же возвеселю1сz њ гDэ.</slav>
		<rus>Да будет благоприятна Ему песнь моя; буду веселиться о Господе.</rus>
	</verse>
	<verse nr="35">
		<slav>
			<num>lє</num> Да и3зчeзнутъ грBшницы t земли2, и3 беззакHнницы, ћкоже не бhти и5мъ. Благослови2, душE моS, гDа.</slav>
		<rus>Да исчезнут грешники с земли, и беззаконных да не будет более. Благослови, душа моя, Господа! Аллилуия!</rus>
	</verse>
</psalm>
