<?xml version="1.0" encoding="Windows-1251"?>
<!DOCTYPE psalm SYSTEM "psalm.dtd">
<?xml-stylesheet type="text/xsl" href="Page.xsl"?>
<psalm nr="91">
	<title>
		<num>№</num> Pал0мъ пёсни, въ дeнь суббHтный, <num>§а</num>.</title>
	<verse nr="1">
		<slav>
			<initial>Б</initial>lго є4сть и3сповёдатисz гDеви и3 пёти и4мени твоемY, вhшній:</slav>
		<rus>Благо есть славить Господа и петь имени Твоему, Всевышний,</rus>
	</verse>
	<verse nr="2">
		<slav>
			<num>G</num> возвэщaти заyтра млcть твою2 и3 истину твою2 на всsку н0щь,</slav>
		<rus>возвещать утром милость Твою и истину Твою в ночи,</rus>
	</verse>
	<verse nr="3">
		<slav>
			<num>д7</num> въ десzтострyннэмъ pалти1ри съ пёснію въ гyслехъ.</slav>
		<rus>на десятиструнном и псалтири, с песнью на гуслях.</rus>
	</verse>
	<verse nr="4">
		<slav>
			<num>є7</num> Ћкw возвесели1лъ мS є3си2, гDи, въ творeніи твоeмъ, и3 въ дёлэхъ рукY твоє1ю возрaдуюсz. </slav>
		<rus>Ибо Ты возвеселил меня, Господи, творением Твоим: я восхищаюсь делами рук Твоих.</rus>
	</verse>
	<verse nr="5">
		<slav>
			<num>ѕ7</num> Ћкw возвели1чишасz дэлA тво‰, гDи: ѕэлw2 ўглуби1шасz помышлє1ніz тво‰.</slav>
		<rus>Как велики дела Твои, Господи! дивно глубоки помышления Твои!</rus>
	</verse>
	<verse nr="6">
		<slav>
			<num>з7</num> Мyжъ безyменъ не познaетъ, и3 неразуми1въ не разумёетъ си1хъ.</slav>
		<rus>Человек несмысленный не знает, и невежда не разумеет того.</rus>
	</verse>
	<verse nr="7">
		<slav>
			<num>}</num> ВнегдA прозzб0ща грBшницы ћкw травA, и3 проник0ша вси2 дёлающіи беззак0ніе, ћкw да потребsтсz въ вёкъ вёка:</slav>
		<rus>Тогда как нечестивые возникают, как трава, и делающие беззаконие цветут, чтобы исчезнуть на веки, -</rus>
	</verse>
	<verse nr="8">
		<slav>
			<num>f7</num> тh же вhшній во вёкъ, гDи.</slav>
		<rus>Ты, Господи, высок во веки!</rus>
	</verse>
	<verse nr="9">
		<slav>
			<num>‹</num> Ћкw сE, врази2 твои2, гDи, ћкw сE, врази2 твои2 поги1бнутъ, и3 разhдутсz вси2 дёлающіи беззак0ніе.</slav>
		<rus>Ибо вот, враги Твои, Господи, - вот, враги Твои гибнут, и рассыпаются все делающие беззаконие;</rus>
	</verse>
	<verse nr="10">
		<slav>
			<num>№i</num> И# вознесeтсz ћкw є3динор0га р0гъ м0й, и3 стaрость моS въ є3лeи масти1тэ:</slav>
		<rus>а мой рог Ты возносишь, как рог единорога, и я умащен свежим елеем;</rus>
	</verse>
	<verse nr="11">
		<slav>
			<num>в7i</num> и3 воззрЁ џко моE на враги2 мо‰, и3 востаю1щыz на мS лукaвнующыz ўслhшитъ ќхо моE.</slav>
		<rus>и око мое смотрит на врагов моих, и уши мои слышат о восстающих на меня злодеях.</rus>
	</verse>
	<verse nr="12">
		<slav>
			<num>Gi</num> Првdникъ ћкw фjніxъ процвэтeтъ: ћкw кeдръ, и4же въ лівaнэ, ўмн0житсz.</slav>
		<rus>Праведник цветет, как пальма, возвышается подобно кедру на Ливане.</rus>
	</verse>
	<verse nr="13">
		<slav>
			<num>д7i</num> Насаждeни въ домY гDни во дв0рэхъ бGа нaшегw процвэтyтъ:</slav>
		<rus>Насажденные в доме Господнем, они цветут во дворах Бога нашего;</rus>
	</verse>
	<verse nr="14">
		<slav>
			<num>є7i</num> є3щE ўмн0жатсz въ стaрости масти1тэ, и3 благопріeмлюще бyдутъ.</slav>
		<rus>они и в старости плодовиты, сочны и свежи,</rus>
	</verse>
	<verse nr="15">
		<slav>
			<num>ѕ7i</num> Да возвэстsтъ, ћкw прaвъ гDь бGъ нaшъ, и3 нёсть непрaвды въ нeмъ.</slav>
		<rus>чтобы возвещать, что праведен Господь, твердыня моя, и нет неправды в Нем.</rus>
	</verse>
</psalm>
