<?xml version="1.0" encoding="Windows-1251"?>
<!DOCTYPE psalm SYSTEM "psalm.dtd">
<?xml-stylesheet type="text/xsl" href="Page.xsl"?>
<psalm nr="6">
	<title>
		<num>№</num> Въ конeцъ, въ пёснехъ њ nсмёмъ, pал0мъ дв7ду, <num>ѕ7</num>.<rus>Начальнику хора. На восьмиструнном. Псалом Давида.</rus>
	</title>
	<verse nr="1">
		<slav>
			<initial>Г</initial>Dи, да не ћростію твоeю њбличи1ши менE, нижE гнёвомъ твои1мъ накaжеши менE. </slav>
		<rus>Господи! не в ярости Твоей обличай меня и не во гневе Твоем наказывай меня.</rus>
	</verse>
	<verse nr="2">
		<slav>
			<num>G</num> Поми1луй мS, гDи, ћкw нeмощенъ є4смь: и3зцэли1 мz, гDи, ћкw смzт0шасz кHсти мо‰,</slav>
		<rus>Помилуй меня, Господи, ибо я немощен; исцели меня, Господи, ибо кости мои потрясены;</rus>
	</verse>
	<verse nr="3">
		<slav>
			<num>д7</num> и3 душA моS смzтeсz ѕэлw2: и3 ты2, гDи, док0лэ;</slav>
		<rus>и душа моя сильно потрясена; Ты же, Господи, доколе?</rus>
	</verse>
	<verse nr="4">
		<slav>
			<num>є7</num> Њбрати1сz, гDи, и3збaви дyшу мою2, сп7си1 мz рaди млcти твоеS:</slav>
		<rus>Обратись, Господи, избавь душу мою, спаси меня ради милости Твоей,</rus>
	</verse>
	<verse nr="5">
		<slav>
			<num>ѕ7</num> ћкw нёсть въ смeрти поминazй тебE, во ѓдэ же кто2 и3сповёстсz тебЁ;</slav>
		<rus>ибо в смерти нет памятования о Тебе: во гробе кто будет славить Тебя?</rus>
	</verse>
	<verse nr="6">
		<slav>
			<num>з7</num> Ўтруди1хсz воздыхaніемъ мои1мъ, и3змhю на всsку н0щь л0же моE, слезaми мои1ми постeлю мою2 њмочY.</slav>
		<rus>Утомлен я воздыханиями моими: каждую ночь омываю ложе мое, слезами моими омочаю постель мою.</rus>
	</verse>
	<verse nr="7">
		<slav>
			<num>}</num> Смzтeсz t ћрости џко моE, њбетшaхъ во всёхъ вразёхъ мои1хъ.</slav>
		<rus>Иссохло от печали око мое, обветшало от всех врагов моих.</rus>
	</verse>
	<verse nr="8">
		<slav>
			<num>f7</num> Tступи1те t менє2, вси2 дёлающіи беззак0ніе, ћкw ўслhша гDь глaсъ плaча моегw2,</slav>
		<rus>Удалитесь от меня все, делающие беззаконие, ибо услышал Господь голос плача моего,</rus>
	</verse>
	<verse nr="9">
		<slav>
			<num>‹</num> ўслhша гDь молeніе моE, гDь моли1тву мою2 пріsтъ.</slav>
		<rus>услышал Господь моление мое; Господь примет молитву мою.</rus>
	</verse>
	<verse nr="10">
		<slav>
			<num>№i</num> Да постыдsтсz и3 смzтyтсz вси2 врази2 мои2, да возвратsтсz и3 ўстыдsтсz ѕэлw2 вск0рэ.</slav>
		<rus>Да будут постыжены и жестоко поражены все враги мои; да возвратятся и постыдятся мгновенно.</rus>
	</verse>
</psalm>
