<?xml version="1.0" encoding="Windows-1251"?>
<!DOCTYPE psalm SYSTEM "psalm.dtd">
<?xml-stylesheet type="text/xsl" href="Page.xsl"?>
<psalm nr="127">
	<title>Пёснь степeней, <num>рк7з</num>.</title>
	<verse nr="1">
		<slav>
			<initial>Б</initial>lжeни вси2 боsщіисz гDа, ходsщіи въ путeхъ є3гw2:</slav>
		<rus>Блажен всякий боящийся Господа, ходящий путями Его!</rus>
	</verse>
	<verse nr="2">
		<slav>
			<num>в7</num> труды2 плодHвъ (рyкъ) твои1хъ снёси: бlжeнъ є3си2, и3 добро2 тебЁ бyдетъ.</slav>
		<rus>Ты будешь есть от трудов рук твоих: блажен ты, и благо тебе!</rus>
	</verse>
	<verse nr="3">
		<slav>
			<num>G</num> ЖенA твоS ћкw лозA плодови1та въ странaхъ д0му твоегw2:</slav>
		<rus>Жена твоя, как плодовитая лоза, в доме твоем; сыновья твои, как масличные ветви, вокруг трапезы твоей:</rus>
	</verse>
	<verse nr="4">
		<slav>
			<num>д7</num> сhнове твои2 ћкw новосаждє1ніz м†сличнаz w4крестъ трапeзы твоеS.</slav>
		<rus>так благословится человек, боящийся Господа!</rus>
	</verse>
	<verse nr="5">
		<slav>
			<num>є7</num> СE, тaкw бlгослови1тсz человёкъ боsйсz гDа.</slav>
		<rus>Благословит тебя Господь с Сиона, и увидишь благоденствие Иерусалима во все дни жизни твоей;</rus>
	</verse>
	<verse nr="6">
		<slav>
			<num>ѕ7</num> Блгcви1тъ тS гDь t сіHна, и3 ќзриши бlг†z їерcли1ма вс‰ дни6 животA твоегw2,</slav>
		<rus>увидишь сыновей у сыновей твоих. Мир на Израиля!</rus>
	</verse>
	<verse nr="7">
		<slav>
			<num>з7</num> и3 ќзриши сhны сынHвъ твои1хъ: ми1ръ на ї}лz.</slav>
		<rus/>
	</verse>
</psalm>
