<?xml version="1.0" encoding="Windows-1251"?>
<!DOCTYPE psalm SYSTEM "psalm.dtd">
<?xml-stylesheet type="text/xsl" href="Page.xsl"?>
<psalm nr="26">
	<title>Pал0мъ дв7ду, прeжде помaзаніz, <num>к7ѕ</num>.</title>
	<verse nr="1">
		<slav>
			<initial>Г</initial>Dь просвэщeніе моE и3 сп7си1тель м0й, когw2 ўбою1сz; гDь защи1титель животA моегw2, t когw2 ўстрашyсz;</slav>
		<rus>Господь - свет мой и спасение мое: кого мне бояться? Господь крепость жизни моей: кого мне страшиться?</rus>
	</verse>
	<verse nr="2">
		<slav>
			<num>в7</num> ВнегдA приближaтисz на мS ѕл0бующымъ, є4же снёсти плHти мо‰, њскорблsющіи мS и3 врази2 мои2, тjи и3знемог0ша и3 пад0ша.</slav>
		<rus>Если будут наступать на меня злодеи, противники и враги мои, чтобы пожрать плоть мою, то они сами преткнутся и падут.</rus>
	</verse>
	<verse nr="3">
		<slav>
			<num>G</num> Ѓще њполчи1тсz на мS п0лкъ, не ўбои1тсz сeрдце моE: ѓще востaнетъ на мS брaнь, на него2 ѓзъ ўповaю.</slav>
		<rus>Если ополчится против меня полк, не убоится сердце мое; если восстанет на меня война, и тогда буду надеяться.</rus>
	</verse>
	<verse nr="4">
		<slav>
			<num>д7</num> Е#ди1но проси1хъ t гDа, то2 взыщY: є4же жи1ти ми2 въ домY гDни вс‰ дни6 животA моегw2, зрёти ми2 красотY гDню и3 посэщaти хрaмъ с™hй є3гw2.</slav>
		<rus>Одного просил я у Господа, того только ищу, чтобы пребывать мне в доме Господнем во все дни жизни моей, созерцать красоту Господню и посещать [святый] храм Его,</rus>
	</verse>
	<verse nr="5">
		<slav>
			<num>є7</num> Ћкw скрh мz въ селeніи своeмъ въ дeнь ѕHлъ мои1хъ, покрh мz въ тaйнэ селeніz своегw2, на кaмень вознесe мz.</slav>
		<rus>ибо Он укрыл бы меня в скинии Своей в день бедствия, скрыл бы меня в потаенном месте селения Своего, вознес бы меня на скалу.</rus>
	</verse>
	<verse nr="6">
		<slav>
			<num>ѕ7</num> И# нн7э сE, вознесE главY мою2 на враги2 мо‰: њбыд0хъ и3 пожр0хъ въ селeніи є3гw2 жeртву хвалeніz и3 воскликновeніz: пою2 и3 воспою2 гDеви.</slav>
		<rus>Тогда вознеслась бы голова моя над врагами, окружающими меня; и я принес бы в Его скинии жертвы славословия, стал бы петь и воспевать пред Господом.</rus>
	</verse>
	<verse nr="7">
		<slav>
			<num>з7</num> Ўслhши, гDи, глaсъ м0й, и4мже воззвaхъ, поми1луй мS и3 ўслhши мS.</slav>
		<rus>Услышь, Господи, голос мой, которым я взываю, помилуй меня и внемли мне.</rus>
	</verse>
	<verse nr="8">
		<slav>
			<num>}</num> ТебЁ речE сeрдце моE: гDа взыщY, взыскA тебE лицE моE, лицA твоегw2, гDи, взыщY.</slav>
		<rus>Сердце мое говорит от Тебя: [ищите лица Моего]; и я буду искать лица Твоего, Господи.</rus>
	</verse>
	<verse nr="9">
		<slav>
			<num>f7</num> Не tврати2 лицA твоегw2 t менє2 и3 не ўклони1сz гнёвомъ t рабA твоегw2: пом0щникъ м0й бyди, не tри1ни менE и3 не њстaви менE, б9е, сп7си1телю м0й.</slav>
		<rus>Не скрой от меня лица Твоего; не отринь во гневе раба Твоего. Ты был помощником моим; не отвергни меня и не оставь меня, Боже, Спаситель мой!</rus>
	</verse>
	<verse nr="10">
		<slav>
			<num>‹</num> Ћкw nтeцъ м0й и3 мaти моS њстaвиста мS, гDь же воспріsтъ мS.</slav>
		<rus>ибо отец мой и мать моя оставили меня, но Господь примет меня.</rus>
	</verse>
	<verse nr="11">
		<slav>
			<num>№i</num> Законоположи1 ми, гDи, въ пути2 твоeмъ, и3 настaви мS на стезю2 прaвую вр†гъ мои1хъ рaди.</slav>
		<rus>Научи меня, Господи, пути Твоему и наставь меня на стезю правды, ради врагов моих;</rus>
	</verse>
	<verse nr="12">
		<slav>
			<num>в7i</num> Не предaждь менE въ дyшы стужaющихъ ми2: ћкw востaша на мS свидётелє непрaведніи, и3 солгA непрaвда себЁ.</slav>
		<rus>не предавай меня на произвол врагам моим, ибо восстали на меня свидетели лживые и дышат злобою.</rus>
	</verse>
	<verse nr="13">
		<slav>
			<num>Gi</num> Вёрую ви1дэти бlг†z гDнz на земли2 живhхъ.</slav>
		<rus>Но я верую, что увижу благость Господа на земле живых.</rus>
	</verse>
	<verse nr="14">
		<slav>
			<num>д7i</num> Потерпи2 гDа, мужaйсz, и3 да крэпи1тсz сeрдце твоE, и3 потерпи2 гDа.</slav>
		<rus>Надейся на Господа, мужайся, и да укрепляется сердце твое, и надейся на Господа.</rus>
	</verse>
</psalm>
