<?xml version="1.0" encoding="Windows-1251"?>
<!DOCTYPE psalm SYSTEM "psalm.dtd">
<?xml-stylesheet type="text/xsl" href="Page.xsl"?>
<psalm nr="64">
	<title>
		<num>№</num> Въ конeцъ, pал0мъ пёсни дв7ду, пёснь їеремjева и3 їезекjилева, людjй преселeніz, є3гдA хотsху и3сходи1ти, <num>…д</num>.</title>
	<verse nr="1">
		<slav>
			<initial>Т</initial>ебЁ подобaетъ пёснь, б9е, въ сіHнэ, и тебЁ воздaстсz моли1тва во їерcли1мэ.</slav>
		<rus>Тебе, Боже, принадлежит хвала на Сионе, и Тебе воздастся обет [в Иерусалиме].</rus>
	</verse>
	<verse nr="2">
		<slav>
			<num>G</num> Ўслhши моли1тву мою2: къ тебЁ всsка пл0ть пріи1детъ.</slav>
		<rus>Ты слышишь молитву; к Тебе прибегает всякая плоть.</rus>
	</verse>
	<verse nr="3">
		<slav>
			<num>д7</num> СловесA беззакHнникъ премог0ша нaсъ: и3 нечє1стіz н†ша ты2 њчтcиши.</slav>
		<rus>Дела беззаконий превозмогают меня; Ты очистишь преступления наши.</rus>
	</verse>
	<verse nr="4">
		<slav>
			<num>є7</num> Бlжeнъ, є3г0же и3збрaлъ є3си2 и3 пріsлъ, всели1тсz во дв0рэхъ твои1хъ. И#сп0лнимсz во бlги1хъ д0му твоегw2: с™ъ хрaмъ тв0й.</slav>
		<rus>Блажен, кого Ты избрал и приблизил, чтобы он жил во дворах Твоих. Насытимся благами дома Твоего, святаго храма Твоего.</rus>
	</verse>
	<verse nr="5">
		<slav>
			<num>ѕ7</num> Ди1венъ въ прaвдэ, ўслhши ны2, б9е, сп7си1телю нaшъ, ўповaніе всёхъ концeй земли2 и3 сyщихъ въ м0ри далeче:</slav>
		<rus>Страшный в правосудии, услышь нас, Боже, Спаситель наш, упование всех концов земли и находящихся в море далеко,</rus>
	</verse>
	<verse nr="6">
		<slav>
			<num>з7</num> ўготовлszй г0ры крёпостію своeю, препоsсанъ си1лою:</slav>
		<rus>поставивший горы силою Своею, препоясанный могуществом,</rus>
	</verse>
	<verse nr="7">
		<slav>
			<num>}</num> смущazй глубинY морскyю, шyму в0лнъ є3гw2 кто2 постои1тъ; смzтyтсz kзhцы,</slav>
		<rus>укрощающий шум морей, шум волн их и мятеж народов!</rus>
	</verse>
	<verse nr="8">
		<slav>
			<num>f7</num> и3 ўбоsтсz живyщіи въ концaхъ t знaменій твои1хъ: и3сх0ды ќтра и3 вeчера ўкраси1ши.</slav>
		<rus>И убоятся знамений Твоих живущие на пределах земли. Утро и вечер возбудишь к славе Твоей.</rus>
	</verse>
	<verse nr="9">
		<slav>
			<num>‹</num> Посэти1лъ є3си2 зeмлю и3 ўпои1лъ є3си2 ю5, ўмн0жилъ є3си2 њбогати1ти ю5: рэкA б9іz нап0лнисz в0дъ: ўгот0валъ є3си2 пи1щу и5мъ, ћкw тaкw (є4сть) ўгот0ваніе.</slav>
		<rus>Ты посещаешь землю и утоляешь жажду ее, обильно обогащаешь ее: поток Божий полон воды; Ты приготовляешь хлеб, ибо так устроил ее;</rus>
	</verse>
	<verse nr="10">
		<slav>
			<num>№i</num> Бразды6 є3S ўп0й, ўмн0жи жи6та є3S: въ кaплzхъ є3S возвесели1тсz возсіsющи (прозzбaющи).</slav>
		<rus>напояешь борозды ее, уравниваешь глыбы ее, размягчаешь ее каплями дождя, благословляешь произрастания ее;</rus>
	</verse>
	<verse nr="11">
		<slav>
			<num>в7i</num> Блгcви1ши вэнeцъ лёта блaгости твоеS, и3 полS тво‰ и3сп0лнzтсz тyка:</slav>
		<rus>венчаешь лето благости Твоей, и стези Твои источают тук,</rus>
	</verse>
	<verse nr="12">
		<slav>
			<num>Gi</num> разботёютъ кр†снаz пустhни, и3 рaдостію х0лми препоsшутсz.</slav>
		<rus>источают на пустынные пажити, и холмы препоясываются радостью;</rus>
	</verse>
	<verse nr="13">
		<slav>
			<num>д7i</num> Њдёzшасz џвни џвчіи, и3 ўдHліz ўмн0жатъ пшени1цу: воззовyтъ, и4бо воспою1тъ.</slav>
		<rus>луга одеваются стадами, и долины покрываются хлебом, восклицают и поют.</rus>
	</verse>
</psalm>
