<?xml version="1.0" encoding="Windows-1251"?>
<!DOCTYPE psalm SYSTEM "psalm.dtd">
<?xml-stylesheet type="text/xsl" href="Page.xsl"?>
<psalm nr="66">
	<title>
		<num>№</num> Въ конeцъ, въ пёснехъ, pал0мъ пёсни дв7ду, <num>…ѕ</num>.</title>
	<verse nr="1">
		<slav>
			<initial>Б</initial>9е, ўщeдри ны2 и3 блгcви1 ны, просвэти2 лицE твоE на ны2 и3 поми1луй ны2: </slav>
		<rus>Боже! будь милостив к нам и благослови нас, освети нас лицем Твоим,</rus>
	</verse>
	<verse nr="2">
		<slav>
			<num>G</num> Познaти на земли2 пyть тв0й, во всёхъ kзhцэхъ спcніе твоE.</slav>
		<rus>дабы познали на земле путь Твой, во всех народах спасение Твое.</rus>
	</verse>
	<verse nr="3">
		<slav>
			<num>д7</num> Да и3сповёдzтсz тебЁ лю1діе, б9е, да и3сповёдzтсz тебЁ лю1діе вси2.</slav>
		<rus>Да восхвалят Тебя народы, Боже; да восхвалят Тебя народы все.</rus>
	</verse>
	<verse nr="4">
		<slav>
			<num>є7</num> Да возвеселsтсz и3 да возрaдуютсz kзhцы: ћкw сyдиши лю1демъ правот0ю, и3 kзhки на земли2 настaвиши.</slav>
		<rus>Да веселятся и радуются племена, ибо Ты судишь народы праведно и управляешь на земле племенами.</rus>
	</verse>
	<verse nr="5">
		<slav>
			<num>ѕ7</num> Да и3сповёдzтсz тебЁ лю1діе, б9е, да и3сповёдzтсz тебЁ лю1діе вси2.</slav>
		<rus>Да восхвалят Тебя народы, Боже, да восхвалят Тебя народы все.</rus>
	</verse>
	<verse nr="6">
		<slav>
			<num>з7</num> ЗемлS дадE пл0дъ св0й: блгcви1 ны, б9е, б9е нaшъ,</slav>
		<rus>Земля дала плод свой; да благословит нас Бог, Бог наш.</rus>
	</verse>
	<verse nr="7">
		<slav>
			<num>}</num> блгcви1 ны, б9е: и3 да ўбоsтсz є3гw2 вси2 концы6 земли2.</slav>
		<rus>Да благословит нас Бог, и да убоятся Его все пределы земли.</rus>
	</verse>
</psalm>
