<?xml version="1.0" encoding="Windows-1251"?>
<!DOCTYPE psalm SYSTEM "psalm.dtd">
<?xml-stylesheet type="text/xsl" href="Page.xsl"?>
<psalm nr="27">
	<title>Pал0мъ дв7ду, <num>к7з</num>.</title>
	<verse nr="1">
		<slav>
			<initial>К</initial>ъ тебЁ, гDи, воззовY, б9е м0й: да не премолчи1ши t менє2 (њ мнЁ): да не когдA премолчи1ши t менє2 (њ мнЁ), и3 ўпод0блюсz низходsщымъ въ р0въ.</slav>
		<rus>К тебе, Господи, взываю: твердыня моя! не будь безмолвен для меня, чтобы при безмолвии Твоем я не уподобился нисходящим в могилу.</rus>
	</verse>
	<verse nr="2">
		<slav>
			<num>в7</num> Ўслhши, гDи, глaсъ молeніz моегw2, внегдA моли1тимисz къ тебЁ, внегдA воздёти ми2 рyцэ мои2 ко хрaму с™0му твоемY.</slav>
		<rus>Услышь голос молений моих, когда я взываю к Тебе, когда поднимаю руки мои к святому храму Твоему.</rus>
	</verse>
	<verse nr="3">
		<slav>
			<num>G</num> Не привлецы2 менE со грBшники, и3 съ дёлающими непрaвду не погуби2 менE, глаг0лющими ми1ръ съ бли1жними свои1ми, ѕл†z же въ сердцaхъ свои1хъ.</slav>
		<rus>Не погуби меня с нечестивыми и с делающими неправду, которые с ближними своими говорят о мире, а в сердце у них зло.</rus>
	</verse>
	<verse nr="4">
		<slav>
			<num>д7</num> Дaждь и5мъ, гDи, по дэлHмъ и4хъ и3 по лукaвству начинaній и4хъ, по дэлHмъ рукY и4хъ дaждь и5мъ, воздaждь воздаsніе и4хъ и5мъ.</slav>
		<rus>Воздай им по делам их, по злым поступкам их; по делам рук их воздай им, отдай им заслуженное ими.</rus>
	</verse>
	<verse nr="5">
		<slav>
			<num>є7</num> Ћкw не разумёша въ дэлA гDнz и3 въ дэлA рукY єгw2: разори1ши | и3 не сози1ждеши |.</slav>
		<rus>За то, что они невнимательны к действиям Господа и к делу рук Его, Он разрушит их и не созиждет их.</rus>
	</verse>
	<verse nr="6">
		<slav>
			<num>ѕ7</num> Блгcвeнъ гDь, ћкw ўслhша глaсъ молeніz моегw2.</slav>
		<rus>Благословен Господь, ибо Он услышал голос молений моих.</rus>
	</verse>
	<verse nr="7">
		<slav>
			<num>з7</num> ГDь пом0щникъ м0й и3 защи1титель м0й: на него2 ўповA сeрдце моE, и3 пом0же ми2, и3 процвэтE пл0ть моS: и3 в0лею моeю и3сповёмсz є3мY.</slav>
		<rus>Господь - крепость моя и щит мой; на Него уповало сердце мое, и Он помог мне, и возрадовалось сердце мое; и я прославлю Его песнью моею.</rus>
	</verse>
	<verse nr="8">
		<slav>
			<num>}</num> ГDь ўтверждeніе людjй свои1хъ и3 защи1титель спасeній хрістA своегw2 є4сть.</slav>
		<rus>Господь - крепость народа Своего и спасительная защита помазанника Своего.</rus>
	</verse>
	<verse nr="9">
		<slav>
			<num>f7</num> Сп7си2 лю1ди тво‰, и3 блгcви2 достоsніе твоE, и3 ўпаси2 |, и3 возми2 (и3 вознеси2) | до вёка.</slav>
		<rus>Спаси народ Твой и благослови наследие Твое; паси их и возвышай их во веки!</rus>
	</verse>
</psalm>
